0313	CARSON	But, you know, when I look at somebody like Hillary Clinton, who sits there and tells her daughter and a government official that no, this was a terrorist attack, and then tells everybody else that it was a video.
0314	CARSON	Where I came from, they call that a lie.
0315	CARSON	And...
0316	SYSTEM	[ cheering and applause ]
0317	CARSON	I think that's very different from, you know, somebody misinterpreting, when I said that I was offered a scholarship to West Point, that is the words that they used.
0318	CARSON	But, I've had many people come and say the same thing to me.
0319	CARSON	That is what people do in those situations.
0320	CARSON	We have to start treating people the same, and finding out what people really think and what they're made of.
0321	CARSON	People who know me know that I'm an honest person.
0322	SYSTEM	[ applause ]
0323	CAVUTO	Thank you, Dr. Carson.
0324	BARTIROMO	Mr. Trump, a federal appeals court just dealt a blow to the Obama administration's plan to prevent the deportation of 5 million people living in this country illegally.
0325	BARTIROMO	The White House is appealing to the Supreme Court.
0326	BARTIROMO	At the heart of this issue is the effect that illegal immigrants are having on our economy, what will you do about it?
0327	TRUMP	I was so happy yesterday when I saw that decision come down.
0328	TRUMP	That was an unbelievable decision.
0329	SYSTEM	[ applause ]
0330	TRUMP	And we don't have enough of those decisions coming down.
0331	TRUMP	He of the executive order, because nobody wants to listen to him, including the Democrats, so he just goes around signing executive orders.
0332	TRUMP	That was a great day.
0333	TRUMP	And, frankly, we have to stop illegal immigration.
0334	TRUMP	It's hurting us economically.
0335	TRUMP	It's hurting us from every standpoint.
0336	TRUMP	It's causing tremendous difficulty with respect to drugs and what that does to many of our inner cities in particular.
0337	TRUMP	And it really is  was such an unbelievable moment because the courts have not been ruling in our favor.
0338	TRUMP	And it was a 21 decision.
0339	TRUMP	And it was a terrific thing that happened.
0340	TRUMP	And I will tell you, we are a country of laws.
0341	TRUMP	We need borders.
0342	TRUMP	We will have a wall.
0343	TRUMP	The wall will be built.
0344	TRUMP	The wall will be successful.
0345	TRUMP	And if you think walls don't work, all you have to do is ask Israel.
0346	TRUMP	The wall works, believe me.
0347	TRUMP	Properly done.
0348	TRUMP	Believe me.
0349	SYSTEM	[ cheering and applause ]
0350	BARTIROMO	Can we just send 5 million people back with no effect on economy?
0351	TRUMP	You are going to have to bring people  you are going to have to send people out.
0352	TRUMP	Look, we're a country...
0353	BARTIROMO	So what will you do?
0354	TRUMP	Maria, we're a country of laws.
0355	TRUMP	We either have a country or we don't have a country.
0356	TRUMP	We are a country of laws.
0357	TRUMP	Going to have to go out and they will come back but they are going to have to go out and hopefully they get back.
0358	TRUMP	But we have no choice if we're going to run our country properly and if we're going to be a country.
0359	SYSTEM	[ cheering and applause ]
0360	BARTIROMO	Thank you, sir.
0361	KASICH	Maria, can we comment on that?
0362	BAKER	Senator Rubio...
0363	KASICH	Can we comment on that?
0364	BAKER	Yes, one quick comment, yes.
0365	KASICH	Well, look, in 1986 Ronald Reagan basically said the people who were here, if they were lawabiding, could stay.
0366	KASICH	But, what didn't happen is we didn't build the walls effectively and we didn't control the border.
0367	KASICH	We need to.
0368	KASICH	We need to control our border just like people have to control who goes in and out of their house.
0369	KASICH	But if people think that we are going to ship 11 million people who are lawabiding, who are in this country, and somehow pick them up at their house and ship them out of Mexico  to Mexico, think about the families.
0370	KASICH	Think about the children.
0371	KASICH	So, you know what the answer really is?
0372	KASICH	If they have been law abiding, they pay a penalty.
0373	KASICH	They get to stay.
0374	KASICH	We protect the wall.
0375	KASICH	Anybody else comes over, they go back.
0376	KASICH	But for the 11 million people, come on, folks.
0377	KASICH	We all know you can't pick them up and ship them across, back across the border.
0378	KASICH	It's a silly argument.
0379	KASICH	It is not an adult argument.
0380	KASICH	It makes no sense.
0381	SYSTEM	[ applause ]
0382	TRUMP	All I can say is, you're lucky in Ohio that you struck oil.
0383	TRUMP	That is for one thing.
0384	SYSTEM	[ laughter ]
0385	TRUMP	Let me just tell you that Dwight Eisenhower, good president, great president, people liked him.
0386	TRUMP	I like Ike, right?
0387	TRUMP	The expression.
0388	TRUMP	I like Ike.
0389	TRUMP	Moved a 1.5 million illegal immigrants out of this country, moved them just beyond the border.
0390	TRUMP	They came back.
0391	TRUMP	Moved them again beyond the border, they came back.
0392	TRUMP	Didn't like it.
0393	TRUMP	Moved them way south.
0394	TRUMP	They never came back.
0395	SYSTEM	[ laughter ]
0396	TRUMP	Dwight Eisenhower.
0397	TRUMP	You don't get nicer.
0398	TRUMP	You don't get friendlier.
0399	TRUMP	They moved a 1.5 million out.
0400	TRUMP	We have no choice.
0401	TRUMP	We have no choice.
0402	SYSTEM	[ crosstalk ]
0403	BAKER	Governor Bush...
0404	KASICH	Jerry, Gerald, it was an attack.
0405	SYSTEM	[ crosstalk ]
0406	UNKNOWN	If you're not going to have my back, I'm going to have my back.
0407	UNKNOWN	A couple things here.
0408	UNKNOWN	First of all...
0409	BAKER	Governor  Governor, you...You should let Jeb speak.
0410	UNKNOWN	We have grown  we have grown...
0411	TRUMP	No, it's unfair.
0412	SYSTEM	[ crosstalk ]
0413	KASICH	In the state of Ohio, the state of Ohio, we have grown 347,000 jobs.
0414	KASICH	Our unemployment is half of what it was.
0415	KASICH	Our fracking industry, energy industry may have contributed 20,000, but if Mr. Trump understood that the real jobs come in the downstream, not in the upstream, but in the downstream.
0416	KASICH	And that's where we're going to get our jobs.
0417	KASICH	But Ohio is diversified.
0418	KASICH	And little false little things, sir, they don't really work when it comes to the truth.
0419	KASICH	So the fact is, all I'm suggesting, we can't ship 11 million people out of this country.
0420	KASICH	Children would be terrified, and it will not work.
0421	SYSTEM	[ crosstalk ]
0422	TRUMP	... built an unbelievable company worth billions and billions of dollars.
0423	TRUMP	I don't have to hear from this man, believe me.
0424	TRUMP	I don't have to hear from him.
0425	BAKER	Mr. Trump, Mr. Trump, you yourself  you yourself said let Governor Bush speak.
0426	BAKER	Governor Bush?
0427	BUSH	Thank you, Donald, for allowing me to speak at the debate.
0428	BUSH	That's really nice of you.
0429	BUSH	Really appreciate that.
0430	SYSTEM	[ applause ]
0431	BUSH	What a generous man you are.
0432	BUSH	Twelve million illegal immigrants, to send them back, 500,000 a month, is just not  not possible.
0433	BUSH	And it's not embracing American values.
0434	BUSH	And it would tear communities apart.
0435	BUSH	And it would send a signal that we're not the kind of country that I know America is.
0436	BUSH	And even having this conversation sends a powerful signal  they're doing highfives in the Clinton campaign right now when they hear this.
0437	BUSH	That's the problem with this.
0438	BUSH	We have to win the presidency.
0439	BUSH	And the way you win the presidency is to have practical plans.
0440	BUSH	Lay them out there.
0441	BUSH	What we need to do is allow people to earn legal status where they pay a fine, where they work, where they don't commit crimes, where they learn English, and over an extended period of time, they earn legal status.
0442	BUSH	That's the path  a proper path...
0443	SYSTEM	[ applause ]
0444	SYSTEM	[ crosstalk ]
0445	BAKER	Senator Rubio?
0446	BAKER	Senator...
0447	TRUMP	We have millions of people right now on line trying to come into this country.
0448	TRUMP	Very, very unfair to the people that want to come into our country legally.
0449	TRUMP	They've gone through the process.
0450	TRUMP	They're on line.
0451	TRUMP	They're waiting.
0452	TRUMP	Very, very unfair to them.
0453	TRUMP	That I can tell you.
0454	SYSTEM	[ applause ]
0455	BAKER	Senator Rubio, Senator Rubio, let me  let me take you to a question that I think gets to the root of a lot of the anxiety that people have in this country.
0456	BAKER	The economy is undergoing a transformation through information technology.
0457	BAKER	Americans are anxious that the new economy isn't producing higherpaying jobs.
0458	BAKER	Many are concerned that the new wealth seems to be going mainly to innovators and investors.
0459	BAKER	Meanwhile, with factories run by robots and shopping done increasingly on smartphones, many traditional jobs are just going away.
0460	BAKER	How do you reassure American workers that their jobs are not being steadily replaced by machines?
0461	RUBIO	Well, you know, that's an excellent question, because what we are going through in this country is not simply an economic downturn.
0462	RUBIO	We are living through a massive economic transformation.
0463	RUBIO	I mean, this economy is nothing like what it was like five years ago, not to mention 15 or 20 years ago.
0464	RUBIO	And it isn't just a different economy.
0465	RUBIO	It's changing faster than ever.
0466	RUBIO	You know, it took the telephone 75 years to reach 100 million users.
0467	RUBIO	It took Candy Crush one year to reach some 100 million users.
0468	SYSTEM	[ laughter ]
0469	RUBIO	So the world is changing faster than ever, and it is disruptive.
0470	RUBIO	Number one, we are in a global competition now, and several of the candidates have said that.
0471	RUBIO	There are now dozens of developed economies on this planet that we have to compete with.
0472	RUBIO	And we lose that competition because we have the highest business tax rate in the industrialized world, because we have regulations that continue to grow by the billions every single week, because we have a crazy health care law that discourages companies from hiring people, but because we're not fully utilizing our energy resources, that if we did, it would bring back all kinds of growth, especially in manufacturing, and because we have an outdated higher education system.
0473	RUBIO	Our higher education system is completely outdated.
0474	RUBIO	It is too expensive, too hard to access, and it doesn't teach 21st century skills.
0475	RUBIO	If we do what needs to be done  tax reform, regulatory reform, fully utilize our energy resources, repeal and replace Obamacare, and modernize higher education, then we can grasp the potential and the promise of this new economy.
0476	RUBIO	And we won't just save the American dream.
0477	RUBIO	We will expand it to reach more people and change more lives than ever before.
0478	RUBIO	And then truly this new century can be a new American century.
0479	SYSTEM	[ applause ]
0480	BAKER	Thank you.
0481	BAKER	Senator Cruz  Senator Cruz, entitlements.
0482	BAKER	You've argued for raising the retirement age and reducing benefits for future retirees, but reducing any sort of benefits for the elderly has always been notoriously hard to do politically.
0483	BAKER	When Speaker Paul Ryan proposed replacing traditional Medicare with federally funded private plans a few years ago, a liberal group responded with a commercial that featured a granny being pushed off a cliff.
0484	BAKER	What's going to be different this time?
0485	CRUZ	Well, my Mom is here, so I don't think we should be pushing any grannies off cliffs.
0486	SYSTEM	[ laughter ]
0487	CRUZ	And, you missstated what I've said on entitlement reform.
0488	CRUZ	What I've said is for seniors we should make no changes whatsoever, for younger workers we should gradually raise the retirement age, we should have benefits grow more slowly, and we should allow them to keep a portion of their taxes in a personal account that they control, and can pass on to their kids...
0489	SYSTEM	[ applause ]
0490	BAKER	...I said for future retirees was your statement...
0491	SYSTEM	[ applause ]
0492	CRUZ	I want to go back to the discussion we had a minute ago because, you know, what was said was right.
0493	CRUZ	The democrats are laughing  because if republicans join democrats as the party of amnesty, we will lose.
0494	SYSTEM	[ applause ]
0495	CRUZ	And, you know, I understand that when the mainstream media covers immigration, it doesn't often see it as an economic issue.
0496	CRUZ	But, I can tell you for millions  of Americans at home watching this, it is a very personal economic issue.
0497	CRUZ	And, I will say the politics of it will be very, very different if a bunch of lawyers or bankers were crossing the Rio Grande.
0498	SYSTEM	[ audience reaction ]
0499	CRUZ	Or if a bunch of people with journalism degrees were coming over and driving down the wages in the press.
0500	CRUZ	[
0501	CRUZ	audience reaction ]
0502	SYSTEM	[ applause and c heering ]
0503	CRUZ	Then, we would see stories about the economic calamity that is befalling our nation.
0504	CRUZ	And, I will say for those of us who believe people 'ought to come to this country legally, and we should enforce the law, we're tired of being told it's antiimmigrant.
0505	CRUZ	It's offensive.
0506	SYSTEM	[ applause ]
0507	CRUZ	I am the son of an immigrant who came legally from Cuba...
0508	SYSTEM	[ bell ringing ]
0509	CRUZ	...to seek the American dream.
0510	CRUZ	And, we can embrace legal immigration while believing in the rule of law  and I would note, try going illegally to another country.
0511	CRUZ	Try going to China, or Japan.
0512	CRUZ	Try going to Mexico.
0513	CRUZ	See what they do.
0514	CRUZ	Every sovereign nation secures its borders, and it is not compassionate to say we're not going to enforce the laws...
0515	SYSTEM	[ bell ringing ]
0516	CRUZ	...And we're going to drive down the wages for millions of hardworking men and women.
0517	CRUZ	That is abandoning the working...
0518	SYSTEM	[ applause ]
0519	BARTIROMO	We go back to Facebook.
0520	BARTIROMO	Dewayne Wesley Cato asks on Facebook, how do we get rid of regulations choking our businesses?
0521	BARTIROMO	Ms. Fiorina?
0522	BARTIROMO	Specifically, under the president's Affordable Care Act, employers with 50 or more employees are required to offer health insurance, or be fined.
0523	BARTIROMO	Many are opting to pay the fine.
0524	BARTIROMO	Others are cutting back employee hours to duck the law altogether.
0525	BARTIROMO	What specific ways will you alleviate the pressure on small business?
0526	FIORINA	Well, first Obamacare has to be repealed because it's failing...
0527	SYSTEM	[ applause ]
0528	FIORINA	...it's failing the very people it was intended to help, but, also, it is croneycapitalism at its worst.
0529	FIORINA	Who helped write this bill?
0530	FIORINA	Drug companies, insurance companies, pharmaceutical companies, every single one of those kinds of companies are bulking up to deal with big government.
0531	FIORINA	See, that's what happens.
0532	FIORINA	As government gets bigger, and bigger  and it has been for 50 years under republicans and democrats alike  and business have to bulk up to deal with big government.
0533	FIORINA	So, we have to repeal it.
0534	FIORINA	It's tens of thousands of pages long, no one can possible understand it except the big companies, the lawyers, the accountants, the lobbyists that they hire to protect their interests.
0535	FIORINA	Then, we have to give back to states the responsibility to manage a high risk pool.
0536	FIORINA	We need to try the one thing in health insurance we've never tried.
0537	FIORINA	Health insurance has always been a cozy, little game between regulators and health insurance companies.
0538	FIORINA	We need to try the free market.
0539	FIORINA	The free market.
0540	FIORINA	Where people actually have to compete.
0541	SYSTEM	[ applause ]
0542	FIORINA	And, we 'ought to have the government ensure that you must  and I don't use that term often, that government 'ought to do something, but every healthcare provider 'ought to publish its costs, its prices, its outcomes, because as patients we don't know what we're buying.
0543	SYSTEM	[ applause ]
0544	FIORINA	Now, let me just say  let me just say, I know more about innovation and entrepreneurship than anyone on this panel because I have led innovative businesses in the most highly competitive industry in the world for decades.
0545	FIORINA	The truth is the secret sauce of America is innovation, and entrepreneurship, it is why we must cut our government down to size, and hold it accountable.
0546	FIORINA	It's why we have to take our government back, because innovation and entrepreneurship is crushed by the crushing load of a 73,000 page tax code.
0547	FIORINA	It is crushed...
0548	SYSTEM	[ bell ringing ]
0549	FIORINA	...by regulatory thicket that is so vast we don't even know what's in it anymore.
0550	FIORINA	It is crushed as well by government bureaucrats who don't do their jobs very well, and who are not held accountable, which is why I've said we got to take our government back, and to do that, we have to know where every dollar being spent, and be able to move any dollar.
0551	FIORINA	We have to hack through this regulatory thicket, repeal so much, but, also, know what's in that regulatory thicket  we don't even know what regulations have been passed.
0552	FIORINA	Third, we need to build a meritocracy  Scott Walker, by the way, is trying now to do in Wisconsin...
0553	SYSTEM	[ bell ringing ]
0554	FIORINA	...Finally, we need to get to a three page tax code, and, yes, that plan exists.
0555	BARTIROMO	Just to be clear, you want to repeal Obamacare...
0556	SYSTEM	[ applause ]
0557	BARTIROMO	..but, what's the alternative?
0558	FIORINA	Sorry, I can't hear you.
0559	BARTIROMO	Just to be clear, you say you would repeal Obamacare...
0560	FIORINA	...Absolutely...
0561	BARTIROMO	...But, what is the alternative...
0562	FIORINA	...You need to give...
0563	BARTIROMO	...and how does that help small business...
0564	FIORINA	The alternative is to allow states to manage high risk pools for those who really need help.
0565	FIORINA	Look, I'm a cancer survivor, OK?
0566	FIORINA	I understand that you cannot have someone who's battled cancer just become known as a preexisting condition.
0567	FIORINA	I understand that you cannot allow families to go bankrupt if they truly need help.
0568	FIORINA	But, I also understand that Obamacare isn't helping anyone.
0569	FIORINA	We're throwing more, and more people into Medicaid, and fewer, and fewer doctors are taking those payments.
0570	FIORINA	The point is Obamacare is crushing small businesses, it is not helping the families it was intended to help.
0571	FIORINA	So, let us allow states to manage high risk pools.
0572	FIORINA	Let us try the one thing in health insurance we've never tried, the free market.
0573	FIORINA	Let us ensure that as patients, and customers...
0574	BARTIROMO	...Thank you...
0575	FIORINA	...that we have information to shop wisely for our health care.
0576	CAVUTO	Alright, thank you.
0577	CAVUTO	We're going to take a break here.
0578	CAVUTO	Coming up, a big issue many Americans are facing, taxes.
0579	CAVUTO	The Republican Presidential Debate continues now, live, from Milwaukee.
0580	SYSTEM	[ commercial break ]
0581	CAVUTO	Welcome back to the Republican presidential debate live from Milwaukee.
0582	CAVUTO	Let's get back to the questions.
0583	CAVUTO	And we want to touch on obviously one of the biggest of this issue in this year, taxes.
0584	CAVUTO	And this will go to several of you.
0585	CAVUTO	One of the biggest economic concerns of course in the country are taxes.
0586	CAVUTO	Facebook data certainly backs that up.
0587	CAVUTO	Once again the green on this map that we're going to see here shows how the conversation around taxes is resonating across the nation, especially here in Wisconsin.
0588	CAVUTO	First off, Dr. Carson, to you.
0589	CAVUTO	You say you are in favor of a tax system, I guess akin to tithing, sir, with a flat tax rate of up to 15 percent because you said, if everybody pays this, I think God is a pretty fair guy, so tithing is a pretty fair process.
0590	CAVUTO	But Donald Trump says that is not fair.
0591	CAVUTO	That wealthier taxpayers should pay a higher rate because it's a fair thing to do.
0592	CAVUTO	So whose plan would God endorse then, Doctor?
0593	SYSTEM	[ laughter ]
0594	CAVUTO	Yours or Mr. Trump's?
0595	CARSON	Well, you know, when I say tithing, I'm talking about the concept of proportionality.
0596	CAVUTO	Right.
0597	CARSON	Everybody should pay the same proportion of what they make.
0598	CARSON	You make $10 billion, you pay a billion.
0599	CARSON	You make $10, you pay one.
0600	CARSON	You get same rights and privileges.
0601	CARSON	I don't see how anything gets a whole lot fairer than that.
0602	CARSON	But you also have to get rid of all the deductions and all the loopholes because that is the thing that tilts it in one direction or another.
0603	CARSON	And you have to set the rate at an appropriate level.
0604	CARSON	Now I will say that, there are a lot of people who say, if you get rid of the deductions, you ruin the American dream because, you know, home mortgage deduction.
0605	CARSON	But the fact of the matter is, people had homes before 1913 when we introduced the federal income tax, and later after that started deductions.
0606	CARSON	And they say there will be no more charitable giving.
0607	CARSON	We had churches before that and charitable organizations before that.
0608	CARSON	The fact of the matter is, I believe if you put more money in people's pockets that they will actually be more generous rather than less generous.
0609	CARSON	And it's...
0610	SYSTEM	[ applause ]
0611	CARSON	... the money that they earned.
0612	CARSON	And, the other thing is, I do care about the poor people.
0613	CARSON	And in the system that we're putting together, there will be a rebate for people at the poverty level.
0614	CARSON	But I also want to emphasize the fact that as we get the economy moving, and I hope I get a question about how do we get the economy moving, there will be a lot more opportunities for poor people not to be poor people because this is America.
0615	CARSON	This is the land of dreams.
0616	CARSON	And our policies should be aimed at allowing people to realize that dream.
0617	SYSTEM	[ applause ]
0618	CAVUTO	Thank you very much.
0619	CAVUTO	Senator Paul, you said you want to blow up the tax code and start over with an acrosstheboard 14.5 percent fair and flat tax.
0620	CAVUTO	You happily offered that it is not revenue neutral and that's the idea.
0621	CAVUTO	You want to choke off the amount of money coming into Washington.
0622	CAVUTO	But don't you risk, sir, creating a nearterm budget crisis just as your presidency would be beginning?
0623	PAUL	Well, it's a great question, Neil, and thanks for including me in the tax debate.
0624	PAUL	I think what's important about the tax debate is, is that we have to ask the question, where is money best spent, in the private sector or in the government sector?
0625	PAUL	I want a government really, really small, so small you can barely see it.
0626	PAUL	So I want lower taxes and much more money in the private sector.
0627	SYSTEM	[ cheering and applause ]
0628	PAUL	My tax plan, however, is the only tax plan among any of the candidates on the stage that is part of a balanced budget plan.
0629	PAUL	I put forward three plans that actually balance the budget over a fiveyear period.
0630	PAUL	Each of these plans have details on exactly where we would cut.
0631	PAUL	The question came up earlier, where would you cut?
0632	PAUL	Nobody likes to say where they would cut.
0633	PAUL	I've put pencil to paper and done three budgets that actually balance.
0634	PAUL	I'm also in favor of a plan called the penny plan where we'd just cut 1 percent across the board and the budget actually balances in less than five years.
0635	PAUL	So I think what is extraordinary about my tax plan is it is in the context of balancing the budget.
0636	PAUL	What is also extraordinary about my tax plan is it gets rid of the payroll tax.
0637	PAUL	Democrats demagogue this issue to death, and when they do they say, oh, a millionaire would get a bigger tax cut than someone making $10,000.
0638	PAUL	That's proportionality, as Ben is trying to explain to folks.
0639	PAUL	But the thing is, is if we get rid of the payroll tax, everybody is going to get a tax cut.
0640	PAUL	And this is something that I think the public at large will support and could win an election.
0641	SYSTEM	[ applause ]
0642	CAVUTO	There are no deductions on your  under your plan?
0643	PAUL	Ours is 14.5 percent for corporations, 14.5 percent for individuals.
0644	PAUL	No payroll tax for the employee.
0645	PAUL	The business tax pays for social security, and there would be two remaining deductions  home mortgage and charity.
0646	CAVUTO	Thank you, Senator.
0647	PAUL	Thank you.
0648	SYSTEM	[ applause ]
0649	BARTIROMO	Senator Cruz, there isn't anyone in this audience or watching at home tonight who would not like to pay less in taxes.
0650	BARTIROMO	Most people just want a fair shake, and they don't want their money to be wasted.
0651	BARTIROMO	But explain how your plan works.
0652	BARTIROMO	How can you cut taxes as much as you propose without running up debt and deficits?
0653	CRUZ	Well, sure, you put your finger on what the problem is.
0654	CRUZ	The current system isn't fair.
0655	CRUZ	Washington is fundamentally corrupt.
0656	CRUZ	There are more words in the IRS code than there are in the Bible  and  and not a one of them is as good.
0657	SYSTEM	[ laughter ]
0658	CRUZ	Every one of them reflects a carveout or a subsidy, and it's all about empowering the Washington cartel.
