0659	CRUZ	My simple Flat Tax says that, for a family of four, for the first $36,000 you earn, you pay no taxes whatsoever.
0660	CRUZ	No income taxes, no payroll taxes, no nothing.
0661	CRUZ	Above that, every American pays 10 percent across the board  a flat, fair tax.
0662	CRUZ	Which means that no longer do you have hedgefund billionaires paying a lower tax rate than their secretaries.
0663	CRUZ	On the business side, I've got a business flat tax of 16 percent  again, that applies across the board.
0664	CRUZ	Right now, with our corporate income tax, giant corporations with armies of accountants regularly are paying little to no taxes while small businesses are getting hammered.
0665	CRUZ	This is fair and acrosstheboard.
0666	CRUZ	Now, you ask, how do the numbers add up?
0667	CRUZ	I would encourage folks, if you go to our website, tedcruz.org, we have the specific numbers on the website.
0668	CRUZ	This plan eliminates the payroll tax, eliminates the death tax, eliminates the corporate income tax, and it abolishes the IRS.
0669	SYSTEM	[ applause ]
0670	CRUZ	And the effect of that is incredible economic growth.
0671	CRUZ	It means every income group will see doubledigit increases, from the very poorest to the very weakest, of at least 14 percent.
0672	CRUZ	So if you're a single mom, if you're making $40,000 a year, what that means is an extra about $5,000 in your pocket to provide for your kids, to make ends meet.
0673	CRUZ	It has a powerful, powerful effect.
0674	CRUZ	And there's one other really powerful feature of my plan, which is that it's borderadjustable.
0675	CRUZ	Which means, if you're an exporter  if you're a farmer, if you're a rancher, if you're a manufacturer, you don't pay the businesses flat tax.
0676	CRUZ	Exports are free of that tax, but all imports pay that 16 percent business flat tax, which means this tax plan would cause jobs to boom, and it would let America compete with China and the world on a level playing field.
0677	SYSTEM	[ applause ]
0678	BARTIROMO	But you haven't told us how to pay for it.
0679	CRUZ	Well, the numbers the Tax Foundation had put out is that the static cost of the plan is $3.6 trillion over 10 years, but the dynamic cost of the plan, which  which is the cost that factors in growth, is about $768 billion.
0680	CRUZ	It is less than a trillion.
0681	CRUZ	It costs less than virtually every other plan people have put up here, and yet it produces more growth and it's one of the very few plans that abolishes the IRS.
0682	CRUZ	But on top of that, today, we rolled out a spending plan.
0683	CRUZ	$500 billion in specific cuts  five major agencies that I would eliminate.
0684	CRUZ	The IRS, the Department of Commerce, the Department of Energy, the Department of Commerce, and HUD  and then 25 specific programs.
0685	CRUZ	Again, that's on our website at tedcruz.org.
0686	CRUZ	You want to look at specificity?
0687	CRUZ	It's easy for everyone to say, "cut spending".
0688	CRUZ	It's much harder and riskier to put out, chapter and verse, specifically the programs you would cut to stop bankrupting our kids and grandkids.
0689	BARTIROMO	Thank you, Senator.
0690	SYSTEM	[ applause ]
0691	BARTIROMO	Governor Bush, Republican primary voters say tax reform should be a priority for Congress and the administration.
0692	BARTIROMO	But, Governor Bush, how important is tax reform in your domestic policy agenda?
0693	BARTIROMO	Will you guarantee it in the first year of your presidency?
0694	BUSH	I'm gonna fight as hard as I can to make sure that we shift power away from Washington, simplify the tax code, to spur economic activity in this country.
0695	BUSH	Of course it's the highest priority.
0696	BUSH	If we don't do that, we're stuck with the "new normal" of 2 percent growth.
0697	BUSH	Hillary Clinton says, basically, we just gotta get used to it.
0698	BUSH	Two percent growth means declining income for the middle class.
0699	BUSH	It means more than 6 million people are stuck in poverty than the day that Barack Obama was inaugurated.
0700	BUSH	It means  it means more demands on government  growing the economy is the first job, if we're going to be serious about dealing with the deficit and debt.
0701	BUSH	And more importantly, people are really struggling right now.
0702	BUSH	In this economy, the disposable income of the great middle is down 2,300 bucks.
0703	BUSH	So yeah, we've created jobs, your  argue (ph)  brought that up early, and it was a good question.
0704	BUSH	Jobs are being created, but they're lowerincome jobs than the jobs that were lost.
0705	BUSH	And the net effect of this is we need to jumpstart the economy.
0706	BUSH	I think of Jonathan (ph) and Reagan Love (ph), who are supporters of mine.
0707	BUSH	Jonathan has been deployed by the National Guard, he is  he's in Oklahoma.
0708	BUSH	Reagan Love  by the way, pretty great name, I think  is a teacher.
0709	BUSH	When  if they had this tax cut, what they told me was that that $2,300 of money in their pocket  they would go back to South Carolina and start a business.
0710	BUSH	Imagine what it would be like, instead of having more businesses closed than started, we had it the exact opposite.
0711	BUSH	We would grow our economy, and the government would get the revenue necessary to make things  make things better.
0712	BUSH	Hillary Clinton's approach to this is more topdown, more regulation, more taxes, more government, and it will destroy our economy.
0713	SYSTEM	[ applause ]
0714	BARTIROMO	Thank you, Governor.
0715	BAKER	Senator Rubio.
0716	BAKER	Can I just come to Senator Rubio?
0717	BAKER	We're coming to you, Mr. Trump, in one second.
0718	BAKER	I  I promise.
0719	TRUMP	Yes.
0720	BAKER	Senator Rubio, your tax plan includes a large expansion of child tax credits to raise off (ph) the tax incomes for lowincome parents.
0721	BAKER	A similar tax credit that you previously proposed in the Senate was estimated to cost as much as $170 billion a year, according to the Tax Foundation.
0722	BAKER	Isn't  isn't there a risk you're just adding another expensive entitle program to an already overburdened federal budget?
0723	RUBIO	The most important job I'm ever going to have, the most important job anyone in this room will ever have, is the job of being a parent.
0724	RUBIO	Not the job of being president, or the job of being a senator, or the job of being a congressman.
0725	RUBIO	The most important job any of us will ever do is the job of being a president (sic), because the most important institution in society is the family.
0726	RUBIO	If the family breaks down, society breaks down.
0727	RUBIO	You can't have a strong nation without strong values, and no one is born with strong values.
0728	RUBIO	They have to be taught to you in strong families and reinforced in you in strong communities.
0729	RUBIO	And so when we set out to do tax reform, we endeavor to have a profamily tax code, and we endeavor to do it because we know how difficult it is for families in the 21st century to afford the cost of living.
0730	RUBIO	It is expensive to raise children in the 21st century, and families that are raising children are raising the future taxpayers of the United States, and everything costs more.
0731	RUBIO	In 35 out of 50 states, child care costs more than college.
0732	RUBIO	There are millions of people watching this broadcast tonight that understand exactly what I'm talking about.
0733	RUBIO	They don't know how they're going to make that payment every month, and if they can't make it, they can't work, because someone needs to watch their kids during the day.
0734	RUBIO	They don't know how they're going to save for their kids' future, to go to college.
0735	RUBIO	And so, yes, I have a child tax credit increase, and I'm proud of it.
0736	RUBIO	I am proud that I have a profamily tax code, because the pro family tax plan I have will strengthen the most important institution in the  in the country, the family.
0737	PAUL	Neil, there's a point I'd like to make here...
0738	SYSTEM	[ applause ]
0739	PAUL	....Neil, a point that I'd like to make about the tax credits.
0740	PAUL	We have to decide what is conservative and what isn't conservative.
0741	PAUL	Is it fiscally conservative to have a trilliondollar expenditure?
0742	PAUL	We're not talking about giving people back their tax money.
0743	PAUL	He's talking about giving people money they didn't pay.
0744	PAUL	It's a welfare transfer payment.
0745	PAUL	So here's what we have.
0746	PAUL	Is it conservative to have $1 trillion in transfer payments  a new welfare program that's a refundable tax credit?
0747	PAUL	Add that to Marco's plan for $1 trillion in new military spending, and you get something that looks, to me, not very conservative.
0748	PAUL	Thank you.
0749	SYSTEM	[ applause ]
0750	SYSTEM	[ crosstalk ]
0751	BAKER	Governor Kasich?
0752	BAKER	Let me come to Governor Kasich.
0753	TRUMP	No, I'm sorry.
0754	TRUMP	No, excuse me.
0755	TRUMP	I was there.
0756	BAKER	Governor Kasich.
0757	SYSTEM	[ crosstalk ]
0758	BAKER	Very quickly, Senator.
0759	RUBIO	Now I get my 60 seconds to respond.
0760	RUBIO	He's talking about my tax plan.
0761	BAKER	Please.
0762	RUBIO	So let me begin with this.
0763	RUBIO	I actually believe  first of all, this is their money.
0764	RUBIO	They do pay.
0765	RUBIO	It is refundable, not just against the taxes they pay to the government, but also the  on their federal income tax, it's refundable against the payroll tax.
0766	RUBIO	Everyone pays payroll tax.
0767	RUBIO	This is their money.
0768	RUBIO	This is not our money.
0769	RUBIO	And here's what I don't understand  if you invest that money in a piece of equipment, if you invest that money in a business, you get to write it off your taxes.
0770	RUBIO	But if you invest it in your children, in the future of America and strengthening your family, we're not going to recognize that in our tax code?
0771	RUBIO	The family is the most important institution in society.
0772	RUBIO	And, yes...
0773	PAUL	Nevertheless, it's not very conservative, Marco.
0774	RUBIO	...
0775	RUBIO	I do want to rebuild the American military.
0776	PAUL	How is it conservative?
0777	RUBIO	I know that Rand is a committed isolationist.
0778	RUBIO	I'm not.
0779	RUBIO	I believe the world is a stronger and a better place, when the United States is the strongest military power in the world.
0780	PAUL	Yeah, but, Marco!
0781	PAUL	Marco!
0782	PAUL	How is it conservative, how is it conservative to add a trilliondollar expenditure for the federal government that you're not paying for?
0783	RUBIO	Because...
0784	PAUL	How is it conservative?
0785	RUBIO	...are you talking about the military, Rand?
0786	PAUL	How is it conservative to add a trillion dollars in military expenditures?
0787	PAUL	You can not be a conservative if you're going to keep promoting new programs that you're not going to pay for.
0788	SYSTEM	[ applause ]
0789	RUBIO	We can't even have an economy if we're not safe.
0790	RUBIO	There are radical jihadist in the Middle East beheading people and crucifying Christians.
0791	RUBIO	A radical Shia cleric in Iran trying to get a nuclear weapon, the Chinese taking over the South China Sea...
0792	SYSTEM	[ applause ]
0793	RUBIO	...Yes, I believe the world is a safer  no, no, I don't believe, I know that the world is a safer place when America is the strongest military power in the world.
0794	SYSTEM	[ cheering and applause ]
0795	PAUL	No.
0796	PAUL	I don't think we're any safer  I do not think we are any safer from bankruptcy court.
0797	PAUL	As we go further, and further into debt, we become less, and less safe.
0798	PAUL	This is the most important thing we're going to talk about tonight.
0799	PAUL	Can you be a conservative, and be liberal on military spending?
0800	PAUL	Can you be for unlimited military spending, and say, Oh, I'm going to make the country safe?
0801	PAUL	No, we need a safe country, but, you know, we spend more on our military than the next ten countries combined?
0802	PAUL	I want a strong national defense, but I don't want us to be bankrupt.
0803	SYSTEM	[ bell ringing ]
0804	SYSTEM	[ crosstalk ]
0805	CRUZ	...Middle ground that brings both of these together...
0806	FIORINA	...Yes, the middle ground is this...
0807	CRUZ	...Exactly right, that we have to defend this nation.
0808	CRUZ	You think defending this nation is expensive, try not defending it.
0809	CRUZ	That's a lot more expensive.
0810	SYSTEM	[ applause and cheering ]
0811	CRUZ	But, you can do that, and pay for it.
0812	CRUZ	You can do that, and also be fiscally responsible.
0813	CRUZ	You know, I mention that the 25 programs that I put today, that I would eliminate them.
0814	CRUZ	Among them are corporate welfare, like sugar subsidies.
0815	CRUZ	Let's take that as an example.
0816	CRUZ	Sugar subsidies.
0817	CRUZ	Sugar farmers farm under...
0818	SYSTEM	[ bell ringing ]
0819	CRUZ	...under roughly 0.2% of the farmland in America, and yet they give 40% of the lobbying money.
0820	CRUZ	That sort of corporate welfare is why we're bankrupting our kids, and grandkids.
0821	CRUZ	I would end those subsidies to pay for defending this nation...
0822	BAKER	...Gentleman, we need to move on...
0823	FIORINA	...This is why  this is why we must combine, actually, zerobased budgeting with tax reform because unless we can examine, and cut, and move, every single dollar of discretionary spending in the federal government, we cannot reform taxes and reduce spending at the same time.
0824	FIORINA	Ask yourself this question, how is it possible that the federal government gets more money each and every year, which the federal government has been doing, receiving more money every year for 50 years under republicans and democrats alike, and yet, never has enough money to do the important things?
0825	FIORINA	The answer?
0826	FIORINA	All the money's always spoken for.
0827	FIORINA	All the money's spoken for.
0828	FIORINA	So, we have to go to zerobased budgeting, which is a simple idea  by the way, there's been a bill for zerosbased (ph) budgeting...
0829	SYSTEM	[ bell ringing ]
0830	FIORINA	...It exists, it can be voted on.
0831	FIORINA	Every dollar must be examined.
0832	FIORINA	Any dollar can be cut.
0833	FIORINA	Any dollar can be cut, any dollar can be moved.
0834	FIORINA	We have to go to a three page tax code.
0835	FIORINA	You lower every rate, you close every loophole, why?
0836	FIORINA	Because the government uses the tax code to decide winners, and losers.
0837	FIORINA	You have to strip the corruption out of the tax code to pay for it.
0838	FIORINA	You have to know where every single dollar is being spent...
0839	BAKER	...We need to move...
0840	FIORINA	...Cut where you need to, and invest where you need to...
0841	BAKER	...We need too...
0842	FIORINA	...The two go hand in hand...
0843	BAKER	...We do need to move on.
0844	BAKER	Mr. Trump...
0845	TRUMP	Please, if I could just...
0846	BAKER	...Very quick.
0847	TRUMP	We have to make our military bigger, better, stronger than ever before so that nobody messes with us, and a long run, it's going to save us.
0848	TRUMP	I agree with Marco, I agree with Ted, we have no choice.
0849	TRUMP	And, I can tell you this with certainty.
0850	TRUMP	We all have a different tax plan.
0851	TRUMP	Some I don't totally agree with.
0852	TRUMP	One thing we understand, each one of those tax plans is better than the mess that we have right now.
0853	SYSTEM	[ applause ]
0854	BAKER	Let's talk about  No, no, Governor, I really must move on.
0855	BAKER	I really want to move on.
0856	BAKER	Mr. Trump, let's talk about the international economy...
0857	KASICH	...Mr. Baker, everybody got to talk about taxes...
0858	BAKER	...We really need to move on...
0859	KASICH	...I think you were coming to me and then...
0860	BAKER	...No, governor, I promise I will come to you...
0861	KASICH	...Look, I hate to crash the party to you, Mr. Baker, but, you know, what's fair...
0862	BAKER	...Listen...
0863	KASICH	...Yes, sir...
0864	BAKER	...Mr. Trump, can I ask you about...
0865	TRUMP	...Yes...
0866	BAKER	...the U.S. just concluded an international trade agreement with 11 countries in the Pacific.
0867	BAKER	You've said that you'd rather have no deal...
0868	TRUMP	...Yeah...
0869	BAKER	...than sign the one that's on the table...
0870	TRUMP	...It's a horrible deal...
0871	BAKER	...Most economists  most economists say that trade is boosted growth, and every single post war president has supported the expansion of international trade, including the last three republican presidents.
0872	BAKER	Why would you reverse more than 50 years of U.S. trade policy?
0873	TRUMP	The TPP is horrible deal.
0874	TRUMP	It is a deal that is going to lead to nothing but trouble.
0875	TRUMP	It's a deal that was designed for China to come in, as they always do, through the back door and totally take advantage of everyone.
0876	TRUMP	It's 5,600 pages long.
0877	TRUMP	So complex that nobodies read it.
0878	TRUMP	It's like Obamacare nobody ever read it.
0879	TRUMP	They passed it nobody read it.
0880	TRUMP	And look at mess we have right now.
0881	TRUMP	And it will be repealed.
0882	TRUMP	But this is one of the worst trade deals.
0883	TRUMP	And I would, yes, rather not have it.
0884	TRUMP	With all of these countries, and all of the bad ones getting advantage and taking advantage of what the good ones would normally get, I'd rather make individual deals with individual countries.
0885	TRUMP	We will do much better.
0886	TRUMP	We lose a fortune on trade.
0887	TRUMP	The United States loses with everybody.
0888	TRUMP	We're losing now over $500 billion in terms of imbalance with China, $75 billion a year imbalance with Japan.
0889	TRUMP	By the way, Mexico, $50 billion a year imbalance.
0890	TRUMP	So I must say, Gerard, I just think it's a terrible deal.
0891	TRUMP	I love trade.
0892	TRUMP	I'm a free trader, 100 percent.
0893	TRUMP	But we need smart people making the deals, and we don't have smart people making the deals.
0894	BAKER	The  the deal, as you say, the terms of the deal were published  were published just last week, the details, 5,000 pages of it, and 80 percent of U.S. trade with countries in the Pacific, these countries, these 11 countries, is actually tarifffree, and these  the trade deal only affects the other 20 percent.
0895	BAKER	Which  are there particular parts of the deal that you think were badly negotiated?
0896	TRUMP	Yes.
0897	TRUMP	Well, the currency manipulation they don't discuss in the agreement, which is a disaster.
0898	TRUMP	If you look at the way China and India and almost everybody takes advantage of the United States  China in particular, because they're so good.
0899	TRUMP	It's the numberone abuser of this country.
0900	TRUMP	And if you look at the way they take advantage, it's through currency manipulation.
0901	TRUMP	It's not even discussed in the almost 6,000page agreement.
0902	TRUMP	It's not even discussed.
0903	BAKER	There was a separate  separate...
0904	SYSTEM	[ crosstalk ]
0905	TRUMP	And as you understand, I mean, you understand very well from the Wall Street Journal, currency manipulation is the single great weapon people have.
0906	TRUMP	They don't even discuss it in this agreement.
0907	TRUMP	So I say, it's a very bad deal, should not be approved.
0908	TRUMP	If it is approved, it will just be more bad trade deals, more loss of jobs for our country.
0909	TRUMP	We are losing jobs like nobody's ever lost jobs before.
0910	TRUMP	I want to bring jobs back into this country.
0911	PAUL	Hey, Gerard, you know, we might want to point out China is not part of this deal.
0912	UNKNOWN	True.
0913	UNKNOWN	It's true.
0914	BARTIROMO	That's right.
0915	BARTIROMO	That's right.
0916	PAUL	Before we get a little bit offkilter here...
0917	BAKER	But isn't that  isn't that part of the problem?
0918	BAKER	When I say, Senator, that if  if this deal is not ratified by  by the U.S.  by the Senate, then it would actually give China an opportunity to grow its economic leadership, which it's been seeking to do?
0919	BAKER	And if the U.S. is unable to take part in this trade deal with these countries in Asia, China will take the lead?
0920	PAUL	There is an argument that China doesn't like the deal, because in us doing the deal, we'll be trading with their competitors.
0921	PAUL	You're exactly right.
0922	PAUL	But I think we've sort of missed the point a little bit here.
0923	PAUL	There is an important point, though, about how we discuss these trade treaties that I do agree with Mr. Trump on.
0924	PAUL	We should negotiate from a position of strength.
0925	PAUL	And we also should negotiate using the full force and the constitutional power that was given to us.
0926	PAUL	I think it's a mistake that we give up power to the presidency on these trade deals.
0927	PAUL	We give up the power to filibuster, and I'm kind of fond of that power.
0928	SYSTEM	[ laughter ]
0929	PAUL	We give up the power to amend.
0930	PAUL	And I think, really, one of the big problems we have in our country is, over the last century, really, so much power has gravitated to the executive branch.
0931	PAUL	Really, Congress is kind of a bystander.
0932	PAUL	We don't write the rules.
0933	PAUL	We don't make the laws.
0934	PAUL	The executive branch does.
0935	PAUL	So even in trade  and I am for trade  I think we should be careful about giving so much power to the presidency.
0936	SYSTEM	[ applause ]
0937	BAKER	Thank you.
0938	BAKER	Thanks, Senator.
0939	BARTIROMO	Coming up, the biggest threats facing the next commanderinchief.
0940	BARTIROMO	You're watching the Republican presidential debate, live tonight from Milwaukee.
0941	BARTIROMO	We'll be right back.
0942	SYSTEM	[ commercial break ]
0943	BARTIROMO	Welcome back.
0944	BARTIROMO	Welcome back to the Republican presidential debate.
0945	BARTIROMO	The candidates taking the questions you want answered.
0946	BARTIROMO	Also tonight, you can see what America is saying about the debate.
0947	BARTIROMO	Go to Facebook and type #gopdebate into the search box.
0948	BARTIROMO	Now, back to the questions.
0949	BARTIROMO	Americans face security threats at home and abroad.
0950	BARTIROMO	Last year, terrorist attacks rose 61 percent, according to the Institute for Economics and Peace, with the most deaths occurring in just five countries, Iraq, Afghanistan, Pakistan, Nigeria, and Syria.
0951	BARTIROMO	Dr. Carson, you were against putting troops on the ground in Iraq and against a large military force in Afghanistan.
0952	BARTIROMO	Do you support the president's decision to now put 50 special ops forces in Syria and leave 10,000 U.S. troops in Afghanistan?
0953	CARSON	Well, putting the special ops people in there is better than not having them there, because they  that's why they're called special ops, they're actually able to guide some of the other things that we're doing there.
0954	CARSON	And what we have to recognize is that Putin is trying to really spread his influence throughout the Middle East.
0955	CARSON	This is going to be his base.
0956	CARSON	And we have to oppose him there in an effective way.
0957	CARSON	We also must recognize that it's a very complex place.
0958	CARSON	You know, the Chinese are there, as well as the Russians, and you have all kinds of factions there.
0959	CARSON	What we've been doing so far is very ineffective, but we can't give up ground right there.
0960	CARSON	But we have to look at this on a much more global scale.
0961	CARSON	We're talking about global jihadists.
0962	CARSON	And their desire is to destroy us and to destroy our way of life.
0963	CARSON	So we have to be saying, how do we make them look like losers?
0964	CARSON	Because that's the way that they're able to gather a lot of influence.
0965	CARSON	And I think in order to make them look like losers, we have to destroy their caliphate.
0966	CARSON	And you look for the easiest place to do that?
0967	CARSON	It would be in Iraq.
0968	CARSON	And if  outside of Anbar in Iraq, there's a big energy field.
0969	CARSON	Take that from them.
0970	CARSON	Take all of that land from them.
0971	CARSON	We could do that, I believe, fairly easily, I've learned from talking to several generals, and then you move on from there.
0972	CARSON	But you have to continue to face them, because our goal is not to contain them, but to destroy them before they destroy us.
0973	SYSTEM	[ applause ]
0974	BARTIROMO	We asked Facebook to take a look at some of the major issues we're talking about, and tackling in this debate tonight.
0975	BARTIROMO	This word cloud shows what people are focusing on the most.
0976	BARTIROMO	The bigger the word, the more the talk.
0977	BARTIROMO	One of the most discussed issues in the last month, homeland security.
0978	BARTIROMO	Governor Bush, what is the biggest threat facing America today?
0979	BUSH	It is  I'd say it is Islamic terrorism, and, back to the question of what we are dealing with in Iraq, when we pull back voids are filled.
0980	BUSH	That's the lesson of history, and, sadly, this president does not believe in American leadership.
0981	BUSH	He does not believe it, and the net result is that we have a caliphate the size of Indiana that gains energy each and everyday to recruit Americans in our own country, and the threat to the homeland relates to the fact that we have not dealt with this threat of terror in the Middle East.
0982	BUSH	We should have a no fly zone in Syria.
0983	BUSH	We should have a support for the remnants of the Syrian Free Army, and create safe zones.
0984	BUSH	If you want to deal with the four million refugees that are leaving Syria because of the devastation there, then we 'ought to create safe zones for them to stay in the region rather than go to Europe.
0985	BUSH	And, that requires American leadership.
0986	BUSH	Without American leadership every other country in the neighborhood beings to change their priorities.
0987	BUSH	It is tragic that you see Iraq, and other countries now talking to Russia.
0988	BUSH	It wasn't that long ago that Russia had no influence in the region at all.
