0001	CAVUTO	It is 900 p.m. on the East Coast, 800 p.m. here inside the Milwaukee theater.
0002	CAVUTO	Welcome to the Republican presidential debate here on the Fox Business Network.
0003	CAVUTO	I'm Neil Cavuto, alongside my comoderators, Maria Bartiromo, and the editorinchief of the Wall Street Journal, Gerard Baker.
0004	BARTIROMO	Tonight we're partnering with the Wall Street Journal to ask questions on the economy that voters want answered.
0005	BARTIROMO	We're also working with Facebook, who tells us that since the first Republican debate, more than 58 million people have joined the political conversation online.
0006	BARTIROMO	More than 9 million are talking specifically about the economy.
0007	BAKER	The candidates on stage tonight were selected based on their standing in an average of four national polls.
0008	BAKER	Those standings determining their position on the stage.
0009	BAKER	And here they are.
0010	BAKER	At center stage, businessman Donald Trump.
0011	SYSTEM	[ applause ]
0012	BAKER	Neurosurgeon Dr. Ben Carson.
0013	SYSTEM	[ applause ]
0014	CAVUTO	Florida Senator Marco Rubio.
0015	SYSTEM	[ applause ]
0016	CAVUTO	Texas Senator Ted Cruz.
0017	SYSTEM	[ applause ]
0018	CAVUTO	Former Florida Governor Jeb Bush.
0019	SYSTEM	[ applause ]
0020	BARTIROMO	Businesswoman Carly Fiorina.
0021	SYSTEM	[ applause ]
0022	BARTIROMO	Ohio Governor John Kasich.
0023	SYSTEM	[ applause ]
0024	BARTIROMO	And Kentucky Senator Rand Paul.
0025	SYSTEM	[ applause ]
0026	BAKER	Tonight's rules are simple.
0027	BAKER	Up to 90 second for each answer.
0028	BAKER	One minute for each followup response.
0029	BAKER	And if a candidate goes over their allotted time, you'll here this.
0030	CAVUTO	It sounds like a game show but it's not.
0031	CAVUTO	Now I would be remiss if I did not acknowledge the elephant in the room, and I'm not talking about your party's fine symbol.
0032	CAVUTO	I'm talking about the purpose of tonight's debate.
0033	CAVUTO	The economy and what each of you would do to improve it.
0034	CAVUTO	No more, no less.
0035	CAVUTO	We are focused on those issues, and what you have said on those issues in your words and what your opponents have said in their words about your words.
0036	CAVUTO	That is the agenda tonight.
0037	CAVUTO	How each of you plans to make America better tomorrow.
0038	CAVUTO	And so we begin.
0039	CAVUTO	Candidates, as we gather tonight in this very august theater, just outside and across the country, picketers are gathering as well.
0040	CAVUTO	They're demanding an immediate hike in the minimum wage to $15 an hour.
0041	CAVUTO	Just a few hours ago, near Governor Andrew Cuomo proposed doing the same for all state workers, the first governor to do so.
0042	CAVUTO	Mr. Trump, as the leading presidential candidate on this stage and one whose tax plan exempts couples making up to $50,000 a year from paying any federal income taxes at all, are you sympathetic to the protesters cause since a $15 wage works out to about $31,000 a year?
0043	TRUMP	I can't be Neil.
0044	TRUMP	And the and the reason I can't be is that we are a country that is being beaten on every front economically, militarily.
0045	TRUMP	There is nothing that we do now to win.
0046	TRUMP	We don't win anymore.
0047	TRUMP	Our taxes are too high.
0048	TRUMP	I've come up with a tax plan that many, many people like very much.
0049	TRUMP	It's going to be a tremendous plan.
0050	TRUMP	I think it'll make our country and our economy very dynamic.
0051	TRUMP	But, taxes too high, wages too high, we're not going to be able to compete against the world.
0052	TRUMP	I hate to say it, but we have to leave it the way it is.
0053	TRUMP	People have to go out, they have to work really hard and have to get into that upper stratum.
0054	TRUMP	But we can not do this if we are going to compete with the rest of the world.
0055	TRUMP	We just can't do it.
0056	CAVUTO	So do not raise the minimum wage?
0057	TRUMP	I would not do it.
0058	SYSTEM	[ applause ]
0059	CAVUTO	Dr. Carson, you have long bemoaned this lackluster recovery.
0060	CAVUTO	And this Facebook map show Americans share your concern.
0061	CAVUTO	The green represents how the jobs issue is resonating all across the nation, especially here in the state of Wisconsin.
0062	CAVUTO	You suggested one minimum wage does not fit all, and that perhaps we should offer a lower or starter wage for young people.
0063	CAVUTO	Those protesters outside are looking for $15 and nothing less.
0064	CAVUTO	Where are you?
0065	CARSON	Well, first of all, delighted to be here.
0066	CARSON	My family's here, and my little granddaughter, who's three years old, said she wanted to come to the debate.
0067	CARSON	So this is very cool.
0068	CARSON	As far as the minimum wage is concerned, people need to be educated on the minimum wage.
0069	CARSON	Every time we raise the minimum wage, the number of jobless people increases.
0070	CARSON	It's particularly a problem in the black community.
0071	CARSON	Only 19.8 percent of black teenagers have a job, who are looking for one.
0072	CARSON	You know, that  and that's because of those high wages.
0073	CARSON	If you lower those wages, that comes down.
0074	CARSON	You know, I can remember, as a youngster  you know, my first job working in a laboratory as a lab assistant, and multiple other jobs.
0075	CARSON	But I would not have gotten those jobs if someone had to pay me a large amount of money.
0076	CARSON	But what I did gain from those jobs is a tremendous amount of experience, and how to operate in the world and how to relate to different people, and how to become a responsible individual.
0077	CARSON	And that's what gave me what I needed to ascend the ladder of opportunity in this country.
0078	CARSON	That's what we need to be thinking about.
0079	CARSON	How do we allow people to ascend the ladder of opportunity, rather than how do we give them everything and keep them dependent?
0080	SYSTEM	[ applause ]
0081	CAVUTO	So, sir, just to be clear, you would not raise it?
0082	CARSON	I would not raise it.
0083	CARSON	I would not raise it, specifically because I'm interested in making sure that people are able to enter the job market and take advantage of opportunities.
0084	SYSTEM	[ applause ]
0085	CAVUTO	Senator Rubio, you called the recent Democratic debate in Las Vegas a night of giveaways, including free health care, free college and a host of other governmentpaid benefits.
0086	CAVUTO	Since you aren't a fan of all they're giving away, tell us tonight what you would take back.
0087	RUBIO	Well, let me begin by answering both the first question and this one, because they're related.
0088	RUBIO	As I've said many times before, my parents were never rich people.
0089	RUBIO	My father was a bartender.
0090	RUBIO	My mother was a maid.
0091	RUBIO	They worked for a living.
0092	RUBIO	But they were successful people, because, despite the fact that they weren't well educated and had those jobs, they made enough money to buy a home in a safe and stable neighborhood, retire with dignity, leave all four of their children better off than themselves.
0093	RUBIO	We call that the American dream, but in fact, it's a universal dream of a better life that people have all over the world.
0094	RUBIO	It is a reminder that every country in the world has rich people.
0095	RUBIO	What makes America special is that we have millions and millions of people that are not rich, that through hard work and perseverance are able to be successful.
0096	RUBIO	The problem is that today people are not successful working as hard as ever because the economy is not providing jobs that pay enough.
0097	RUBIO	If I thought that raising the minimum wage was the best way to help people increase their pay, I would be all for it, but it isn't.
0098	RUBIO	In the 20th century, it's a disaster.
0099	RUBIO	If you raise the minimum wage, you're going to make people more expensive than a machine.
0100	RUBIO	And that means all this automation that's replacing jobs and people right now is only going to be accelerated.
0101	RUBIO	Here's the best way to raise wages.
0102	RUBIO	Make America the best place in the world to start a business or expand an existing business, tax reform and regulatory reform, bring our debt under control, fully utilize our energy resources so we can reinvigorate manufacturing, repeal and replace Obamacare, and make higher education faster and easier to access, especially vocational training.
0103	RUBIO	For the life of me, I don't know why we have stigmatized vocational education.
0104	RUBIO	Welders make more money than philosophers.
0105	RUBIO	We need more welders and less philosophers.
0106	SYSTEM	[ applause ]
0107	RUBIO	If we do that  and if we do this  if we do this, we will be able to increase wages for millions of Americans and we will be able to leave everyone better off without making anyone worse off.
0108	CAVUTO	Thank you, Senator Rubio.
0109	SYSTEM	[ applause ]
0110	BARTIROMO	We've asked people on Facebook to submit their questions for the candidates.
0111	BARTIROMO	Seth Bell wrote, "We are approaching $20 trillion in national debt.
0112	BARTIROMO	Specifically, what plans do you have to cut federal spending?"
0113	BARTIROMO	Governor Kasich, you have spoken much about your success in balancing the budget under President Clinton.
0114	BARTIROMO	Today the national debt is at record highs and growing unsustainably.
0115	BARTIROMO	Interest will be the fastestgrowing part of the federal budget, tripling over the next 10 years.
0116	BARTIROMO	Social Security, the lifeline of millions of American seniors, is rushing toward insolvency.
0117	BARTIROMO	With all of the tax plans presented tonight, estimated to cost anywhere between $2 trillion and $12 trillion over a decade, what specific steps will you take to balance the budget?
0118	KASICH	First of all, let me just say that, in the state of Ohio  and I'm the only acting executive on  on this stage today  we do have a moderate increase in the minimum wage.
0119	KASICH	And I got to tell you, my father carried mail on his back.
0120	KASICH	His father was a coal miner.
0121	KASICH	He died of black lung.
0122	KASICH	He was losing his eyesight.
0123	KASICH	My mother's mother lived with us.
0124	KASICH	She could barely speak English.
0125	KASICH	I come from a town where if the wind blew the wrong way, people found themselves out of work.
0126	KASICH	An economic theory is fine, but you know what?
0127	KASICH	People need help.
0128	KASICH	Now, I have a plan that, in fact, would cut taxes, but not $11 trillion or $12 trillion that would put my children further in debt.
0129	KASICH	I have a plan that would not only cut taxes, lower the income tax rate for individuals, lower the tax for businesses so businesses will compete here and not move operations overseas, and also a plan  the only plan of anybody standing on this stage to get us to a balanced budget by the end of a second term.
0130	KASICH	And, you know, the simple fact of the matter is, we hear a lot of promises in this debate, a lot of promises about these tax cuts or tax schemes sometimes that I call them.
0131	KASICH	Hillary and the Democrats promise everything on the spending side.
0132	KASICH	We've got to be responsible about what we propose on the tax side.
0133	KASICH	Yes, lower taxes, lower spending.
0134	KASICH	My website, JohnKasich.com, will show you exactly how we balance the budget.
0135	KASICH	I balanced the budget in Washington as a chief architect, and I have balanced it in Ohio for one reason.
0136	KASICH	When you balance the budget and you cut taxes, people get work.
0137	KASICH	And our most important moral purpose as leaders in the political system is to make sure we create an environment for job creation so people can live their dreams and realize their Godgiven potential.
0138	KASICH	That's why it's so important.
0139	KASICH	And for those at the bottom, we've got to do what we can to train them so they can move up.
0140	KASICH	But to just look the other way is not acceptable, because, you know what, as the governor of Ohio I have to deal with real challenges, and we've gotten it done in our state, and I will do it for America.
0141	SYSTEM	[ applause ]
0142	BARTIROMO	Did you want to name any specific steps, sir?
0143	KASICH	Sure.
0144	KASICH	We would move the Medicare system from a 7 percent growth down to about a 5 percent growth.
0145	KASICH	And I have a whole series of ways to do that.
0146	KASICH	In Ohio, we reduced Medicaid funding for the poor from 10 percent to 2.5 percent, didn't cut one benefit or didn't take anybody off the rolls.
0147	KASICH	Why?
0148	KASICH	Because we're innovators.
0149	KASICH	I've been an innovator my entire career.
0150	KASICH	And I really don't care what special interests or lobbyists have to say.
0151	KASICH	I have a job to do when I take over a public office.
0152	KASICH	Now, we freeze nondefense discretionary for eight years.
0153	KASICH	We also put an increase in defense spending.
0154	KASICH	Our tax cuts balance out.
0155	KASICH	And at the end of the day, we will get to a balanced budget.
0156	KASICH	And I want everybody here to know, when I was Budget Committee chairman in Washington, I stepped on every toe in that town, and we got to a balanced budget, and we had enormous job growth.
0157	KASICH	And as governor of Ohio, we went from 350,000 lost jobs to a gain of 347,000 jobs.
0158	BARTIROMO	Thank you, sir.
0159	KASICH	I'll do it in Washington.
0160	KASICH	I've done it twice I'll do it thrice for the United States of America.
0161	BARTIROMO	Senator Cruz, the International Monetary Fund recently cut its expectations for economic growth.
0162	BARTIROMO	Many economists expect a recession to hit the U.S. within the next year due to the weakening of manufacturing.
0163	BARTIROMO	The next president will have to deal with it.
0164	BARTIROMO	You say tax reform is a powerful lever to spur economic expansion.
0165	BARTIROMO	You're calling for a 10 percent income tax and a 16 percent business tax.
0166	BARTIROMO	What other elements do you need in this plan to actually create jobs?
0167	CRUZ	Well, Maria, it's great to be with you.
0168	CRUZ	It's great to be here in Milwaukee.
0169	CRUZ	You know, the question you asked really I think is the most important question any of us can have  face, which is, how do we get the economy growing?
0170	CRUZ	How do we bring back economic growth?
0171	CRUZ	Because economic growth, it's foundational to every other challenge we have.
0172	CRUZ	As you rightly noted, from 2008 to today, our economy has grown 1.2 percent a year on average.
0173	CRUZ	The Obama economy is a disaster, and the IMF is telling us this is a new normal.
0174	CRUZ	It doesn't have to be.
0175	CRUZ	If you look at the history of America, there are three levers that government has had to facilitate economic growth.
0176	CRUZ	The first is tax reform.
0177	CRUZ	And as you noted, I have rolled out a bold and simple flat tax 10 percent for every American that would produce booming growth and 4.9 million new jobs within a decade.
0178	CRUZ	The second element is regulatory reform, pulling back the armies of regulators that have descended like locusts on small businesses.
0179	CRUZ	And the third element is sound money.
0180	CRUZ	Every time we've pursued all three of those  whether in the 1920s with Calvin Coolidge or the 1960s with JFK or the 1980s with Ronald Reagan  the result has been incredible economic growth.
0181	CRUZ	We have done it before, and with leadership, we can do it again.
0182	SYSTEM	[ applause ]
0183	BARTIROMO	Thank you, sir.
0184	KASICH	Excuse me.
0185	BARTIROMO	Governor Bush...
0186	KASICH	Yeah, I would like to make a comment.
0187	BUSH	You've already made two comments, John.
0188	BUSH	It's my turn.
0189	BARTIROMO	We have more questions for you, Governor Kasich, coming up.
0190	BARTIROMO	We have more questions for you, Governor Kasich.
0191	BUSH	I got about four minutes in the last debate.
0192	BUSH	I'm going to get my question right now.
0193	KASICH	I appreciate it, Jeb.
0194	KASICH	I'm all of you.
0195	KASICH	But I want at some point to talk about a valueadded tax and $11 trillion, $12 trillion tax cuts that will put our kids way deeper in the hole than they have been at this point.
0196	KASICH	So I would like to talk about it at some point, because that's what leadership is.
0197	BARTIROMO	We will  we will certainly get to that.
0198	BARTIROMO	Governor Bush?
0199	BUSH	Yes.
0200	BARTIROMO	Almost 40 percent of Americans are without a job and are not looking.
0201	BARTIROMO	Many have given up.
0202	BARTIROMO	That's what the participation rate tells us.
0203	BARTIROMO	You've said your policies will drive the economy back to 4 percent growth, which we haven't seen since the year 2000.
0204	BARTIROMO	What specific regulations would you change?
0205	BARTIROMO	And how will that lead to jobs and growth?
0206	BUSH	First of all, we could get to 4 percent growth.
0207	BUSH	The new normal of 2 percent puts huge demands on government.
0208	BUSH	The reason why we have structural deficits is that more and more people are relying on government and the growth that we don't have makes  makes the deficit grow.
0209	BUSH	A 4 percent growth strategy starts with tax reform.
0210	BUSH	And the proposal that I've laid out is the one the Wall Street Journal editorial board has said is the most progrowth of all the proposals out there.
0211	BUSH	We cut the  we eliminate a lot of deductions and cut the rates down.
0212	BUSH	A corporate rate of 20 percent, which puts us 5 percent above  below that of China, and allows us full expensing of investing.
0213	BUSH	It would create an explosion of investment back into this country, creating higherwage jobs, and so that's part of it.
0214	BUSH	On the regulatory side I think we need to repeal every rule that Barack Obama has in terms of work in progress, every one of them.
0215	SYSTEM	[ applause ]
0216	BUSH	And start over.
0217	BUSH	For those that are already in existence, the regulation of the Internet, we have to start over, but we ought to do that.
0218	BUSH	The clean power act, we ought to repeal that and  and start over on that.
0219	BUSH	The waters of the United States act, which is going to be devastating for agriculture and many industries, we should repeal that.
0220	BUSH	We should repeal the rules because the economic costs of this far exceed the social benefit.
0221	BUSH	And if we're serious about being serious about high growth, then we have to recognize that small businesses right now, more of them are closing than  than are  than are being set up.
0222	BUSH	Hillary Clinton has said that Barack Obama's policies get an A.
0223	BUSH	Really?
0224	BUSH	One in 10 people right now aren't working or have given up altogether, as you said.
0225	BUSH	That's not an A.
0226	BUSH	One in seven people are living in poverty.
0227	BUSH	That's not an A.
0228	BUSH	One in five children are on food stamps.
0229	BUSH	That is not an A.
0230	BUSH	It may be the best that Hillary Clinton can do, but it's not the best America can do.
0231	SYSTEM	[ applause ]
0232	BARTIROMO	Thank you, sir.
0233	BAKER	Ms. Fiorina, while you've all pointed out how weak the current recovery has been and how disappointing by any historical standards, in the general election, the Democrats will inevitably ask you and voters to compare the recent president's jobs performance.
0234	BAKER	Now, in seven years under President Obama, the U.S. has added an average of 107,000 jobs a month.
0235	BAKER	Under President Clinton, the economy added about 240,000 jobs a month.
0236	BAKER	Under George W. Bush, it was only 13,000 a month.
0237	BAKER	If you win the nomination, you'll probably be facing a Democrat named Clinton.
0238	BAKER	How are you going to respond to the claim that Democratic presidents are better at creating jobs than Republicans?
0239	FIORINA	Well, first of all, I must say as I think about that question, I think about a woman I met the other day.
0240	FIORINA	I would guess she was 40 years old.
0241	FIORINA	She had several children.
0242	FIORINA	And she said to me, you know, Carly, I go to bed every night afraid for my children's future.
0243	FIORINA	And that really struck me.
0244	FIORINA	This is America.
0245	FIORINA	A mother is going to bed afraid for her children's future.
0246	FIORINA	And the reason she's afraid for her children's future is because we've had problems for a long time.
0247	FIORINA	Yes, problems have gotten much worse under Democrats.
0248	FIORINA	But the truth is, this government has been growing bigger and bigger, more corrupt, less effective, crushing the engine of economic growth for a very long time.
0249	FIORINA	This isn't about just replacing a Democrat with a Republican now.
0250	FIORINA	It's about actually challenging the status quo of big government.
0251	FIORINA	Big government has created a big business called politics.
0252	FIORINA	And there are lots of people invested in the status quo of that big business called politics.
0253	FIORINA	Specifically, we need actually to do five things to really get this economy going again.
0254	FIORINA	We need to go to zerobased budgeting so we know where every dollar is being spent, we can challenge any dollar, cut any dollar, move any dollar.
0255	SYSTEM	[ applause ]
0256	FIORINA	We need to actually reform the tax code.
0257	FIORINA	Go to a threepage tax code.
0258	FIORINA	Yes, there are plans that would reform our tax code to three pages.
0259	FIORINA	In addition to rolling back what President Obama has done, we need to do a toptobottom review of every single regulation on the books.
0260	FIORINA	That hasn't been done in 50 years.
0261	FIORINA	We need to pass the REINS Act so Congress is in charge of regulation, not nameless, faceless bureaucrats accountable to no one.
0262	FIORINA	We've become a nation of rules, not a nation of laws.
0263	FIORINA	And finally we actually, yes, have to hold government officials accountable for their performance.
0264	FIORINA	All this has to be done, and the citizens of this nation must help a President Fiorina get it done.
0265	FIORINA	We must take our government back.
0266	SYSTEM	[ applause ]
0267	BAKER	Thank you.
0268	BAKER	Thank you.
0269	BAKER	Senator Paul, income inequality has been rising in the United States.
0270	BAKER	Fifty years ago, for example, the average CEO of a big corporation in this country earned 20 times the average salary of one of his or her workers.
0271	BAKER	Today, that CEO earns about 300 times the average salary of a worker.
0272	BAKER	Does it matter at all that the gap between the rich and everyone else is widening?
0273	PAUL	Absolutely.
0274	PAUL	And I think that we ought to look where income inequality seems to be the worst.
0275	PAUL	It seems to be worst in cities run by Democrats, governors of...
0276	SYSTEM	[ applause ]
0277	PAUL	States run by Democrats and countries currently run by Democrats.
0278	PAUL	So the thing is, let's look for root causes.
0279	PAUL	But I would also say  lay some blame at the  the feet of the Federal Reserve.
0280	PAUL	I think the Federal Reserve has made this problem worse.
0281	PAUL	By artificially keeping interest rates below the market rate, average ordinary citizens have a tough time earning interest, have a tough time making money.
0282	PAUL	They're actually talking now about negative interest.
0283	PAUL	The money as it's created through quantitative easing or other means tends to start out in the big banks in New York.
0284	PAUL	And because we're now paying interest for them to keep the money there, much of that money has not filtered out into the economy.
0285	PAUL	So what we're finding is there is increasing income disparity and income inequality.
0286	PAUL	We also find that as the Federal Reserve destroys the value of the currency, what you're finding is that, if you're poor, if you make $20,000 a year and you have three or four kids, and you're trying to get by, as your prices rise or as the value of the dollar shrinks, these are the people that are hurt the worst.
0287	PAUL	So really we need to reexamine whether we not  we want a Federal Reserve that's involved so much in determining interest rates.
0288	PAUL	We also need to look at root causes as to what caused the housing boom and the housing collapse.
0289	PAUL	But the bottom line is, if you want less income inequality, move to a city with a Republican mayor or a state with a Republican governor.
0290	SYSTEM	[ applause ]
0291	BAKER	Thank you, Senator.
0292	CAVUTO	All right.
0293	CAVUTO	We're only just getting started.
0294	CAVUTO	Coming up, your taxes.
0295	CAVUTO	Stick around.
0296	CAVUTO	You're watching FOX Business
0297	SYSTEM	[ commercial break ]
0298	CAVUTO	Welcome back to the Milwaukee Theater and the Republican presidential debate.
0299	CAVUTO	Let's get right back to our questions.
0300	CAVUTO	Dr. Carson, to you.
0301	CAVUTO	You recently railed against the double standard in the media, sir, that seems obsessed with inconsistencies and potential exaggerations in your life story, but looked the other way when it came to thenSenator Barack Obama's.
0302	CAVUTO	Still, as a candidate whose brand has always been trust, are you worried your campaign  which you've always said, sir, is bigger than you  is now being hurt by you?
0303	CARSON	Well, first of all, thank you not asking me what I said in the 10th grade.
0304	CARSON	I appreciate that.
0305	SYSTEM	[ laughter and a pplause ]
0306	CAVUTO	I'll just forget that followup there.
0307	SYSTEM	[ laughter ]
0308	CARSON	The fact of the matter is, you know, what  we should vet all candidates.
0309	CARSON	I have no problem with being vetted.
0310	CARSON	What I do have a problem with is being lied about and then putting that out there as truth.
0311	SYSTEM	[ applause ]
0312	CARSON	And I don't even mind that so much, if they do it about  with everybody, like people on the other side.
