0599	JOY-ANN REID	He could be anything in the general election.
0600	JOY-ANN REID	He could pivot back on social issues to a place where he's not offending Democratic voters.
0601	CHUCK TODD	Well, this is the thing
0602	NICOLLE WALLACE	But women
0603	JOY-ANN REID	But thats on that, but he'll offend African Americans, women, Muslims, and everyone else, some issues
0604	JOSE DIAZ-BALART	Dont forget, most of the immigrants across the border are rapists and murderers.
0605	CHUCK TODD	But, I think what's fascinating is that
0606	JOSE DIAZ-BALART	That would come back.
0607	JOY-ANN REID	And that would come back.
0608	CHUCK TODD	The bathroom issue brought Cruz and Clinton together.
0609	CHUCK TODD	Sort of.
0610	NICOLLE WALLACE	But I think Trump's answer Trumps answer got him a lot of credit with a lot of people.
0611	CHUCK TODD	It did.
0612	CHUCK TODD	All right, I've got to take a quick break.
0613	CHUCK TODD	When we come back, U.S. insists there's no evidence that any highlevel Saudi Arabian government officials played a role in plotting 911.
0614	CHUCK TODD	So why does the American government refuse to release 28 pages of a congressional report that could tell a different story?
0615	CHUCK TODD	President Obama's been on the world stage this week, meeting the Queen of England, and a future king, Prince George even stayed up past his bedtime to meet the President.
0616	CHUCK TODD	But he got a somewhat chilly reception early in the week in Saudi Arabia, where he was greeted on the tarmac by a relatively minor member of the royal family.
0617	CHUCK TODD	Just the governor of Riyadh, roughly the equivalent of the United States sending a local governor to greet a major foreign leader when they land on U.S. soil.
0618	CHUCK TODD	U.S.Saudi relations are strained, to put it mildly, at the moment.
0619	CHUCK TODD	With renewed calls in Washington to declassify 28 pages of a congressional report on 911 that some believe allege some direct links to the Arab kingdom when it comes to the 911 attacks.
0620	CHUCK TODD	It's a link the Saudis have strenuously denied for years.
0621	CHUCK TODD	Well, I'm joined by one of the chief proponents of declassifying those 28 pages, former Senator Bob Graham of Florida.
0622	CHUCK TODD	He served as cochair of that congressional inquiry, was chairman of the intelligence committee for that period of time, a familiar face at that period of time.
0623	CHUCK TODD	Senator Graham, welcome back to Meet the Press.
0624	SEN. BOB GRAHAM	Thank you, Chuck.
0625	CHUCK TODD	All right.
0626	CHUCK TODD	Let's go right to the specifics of these 28 pages.
0627	CHUCK TODD	What is in them that the American high levels of American officials and Saudi officials fear will change things if they become public?
0628	SEN. BOB GRAHAM	Chuck, to me, the most important unanswered question of 911 is did these 19 people conduct this very sophisticated plot alone, or were they supported?
0629	SEN. BOB GRAHAM	I think it's implausible to think that people who couldn't speak English, had never been in the United States before, as a group were not welleducated could have done that.
0630	SEN. BOB GRAHAM	So who was the most likely entity to have provided them that support?
0631	SEN. BOB GRAHAM	And I think all the evidence points to Saudi Arabia.
0632	SEN. BOB GRAHAM	We know that Saudi Arabia started Al Qaeda.
0633	SEN. BOB GRAHAM	It was a creation of Saudi of Saudi Arabia..
0634	CHUCK TODD	And when you say Saudi Arabia, are you saying the government?
0635	CHUCK TODD	Or are you saying wealthy individuals who happen to be Saudi Arabian?
0636	SEN. BOB GRAHAM	That is a very murky line.
0637	SEN. BOB GRAHAM	Saudi Arabia has made it murky by its own legal action.
0638	SEN. BOB GRAHAM	Whenever a U.S. group sues a Saudi Arabian entity, whether its a bank, a foundation, a charity, immediately, the defense of sovereign immunity is raised.
0639	SEN. BOB GRAHAM	The Saudis don't recognize the difference between a royal decision and a societal decision in the same way that other countries might.
0640	SEN. BOB GRAHAM	So I think it covers a broad range, from the highest ranks of the kingdom through these, what would be private entities.
0641	CHUCK TODD	Okay.
0642	CHUCK TODD	If this gets released publicly, and again, I know you don't want to say what's in it, you don't want to but let me ask you this.
0643	CHUCK TODD	One description that has been made of these 28 pages is that it's basically an initial police report that if you looked at it, you would say, "Wow, we should investigate that, that, that and that more."
0644	CHUCK TODD	Is that the best way to describe this?
0645	SEN. BOB GRAHAM	No.
0646	SEN. BOB GRAHAM	This report was 850 pages.
0647	SEN. BOB GRAHAM	This is 28 pages out of that.
0648	SEN. BOB GRAHAM	There's been no questions raised about the professionalism and quality of the other 820 pages of this report.
0649	SEN. BOB GRAHAM	And this chapter followed the same standards that they did.
0650	SEN. BOB GRAHAM	Instead of debating what might be there, why don't we let the American people read the 28 pages, and the other thousands of documents that have been withheld that relate to the Saudi involvement in 911.
0651	SEN. BOB GRAHAM	And then make up their own mind.
0652	CHUCK TODD	What keeps this from why do I feel like candidate Barack Obama or Senator Barack Obama might be in a different place?
0653	CHUCK TODD	What is it within the minute somebody gets into the executive branch, Republican or Democrat, there is this consensus publicly to protect Saudi Arabia?
0654	SEN. BOB GRAHAM	I think it goes back to the fact that 60 years ago, Franklin Roosevelt and the King of Saudi Arabia entered into a special relationship.
0655	SEN. BOB GRAHAM	We provided them with security, they provided us with petroleum.
0656	SEN. BOB GRAHAM	And that has affected the culture and the attitude around this relationship.
0657	SEN. BOB GRAHAM	But I think it's fundamentally changed, it's changing almost on a daily basis, as we are less dependent on the Saudis for petroleum, as some of the things that the Saudis are doing are so dramatically adverse to our interests, such as training the next generation of the young terrorists in their mosque in schools  their madrasas.
0658	SEN. BOB GRAHAM	The schism between the United States and Saudi Arabia is now very apparent.
0659	SEN. BOB GRAHAM	And I think this is the time to inject the truth of that relationship in the process of deciding what we should be doing in the future.
0660	CHUCK TODD	The president, can he order the declassification on his own?
0661	SEN. BOB GRAHAM	Yes.
0662	SEN. BOB GRAHAM	The president has the full responsibility and the authority to do so.
0663	SEN. BOB GRAHAM	And I hope that he will do so and again, not only for these 28 pages, but there are 80,000 documents in a federal courtroom in Fort Lauderdale, Florida, relative to an investigation that took place on a relationship between Mohamed Atta, the leader of the 19
0664	CHUCK TODD	Right.
0665	SEN. BOB GRAHAM	and two of his henchmen, and a prominent Saudi family living in Sarasota.
0666	CHUCK TODD	On a scale of one to ten, the release of these pages, how would you rate the impact on U.S.  Saudi relations if they go public?
0667	SEN. BOB GRAHAM	7.838.
0668	CHUCK TODD	Very accurate there.
0669	CHUCK TODD	So pretty, you think it will have a high level negative impact?
0670	SEN. BOB GRAHAM	Yes.
0671	CHUCK TODD	All right, Senator Bob Graham, I'm going to leave it there.
0672	CHUCK TODD	You'll see, you think you'll get it done?
0673	CHUCK TODD	You think you'll get these released?
0674	SEN. BOB GRAHAM	I think so.
0675	SEN. BOB GRAHAM	The President's staff at least has said that they will make a decision by June.
0676	SEN. BOB GRAHAM	And I hope that decision is to honor the American people and make it available.
0677	CHUCK TODD	Senator Bob Graham, thanks for coming in.
0678	CHUCK TODD	Good to see you, sir.
0679	SEN. BOB GRAHAM	Thanks, Chuck.
0680	CHUCK TODD	We'll be back in just 45 seconds, a little endgame segment.
0681	CHUCK TODD	And the game that at least gets played late in presidential primary campaign, veep stakes.
0682	CHUCK TODD	It's a weird one this year.
0683	CHUCK TODD	Who will Hillary Clinton pick as a running mate?
0684	CHUCK TODD	We'll be right back.
0685	CHUCK TODD	Endgame time, the panel is here.
0686	CHUCK TODD	Boy, part of me wants to delve more into the Saudi thing.
0687	CHUCK TODD	You know, there's a lot there.
0688	CHUCK TODD	But let's go to The New York Times threw out the first of the veepstakes when it comes to at least Hillary Clinton.
0689	CHUCK TODD	And I think we have an idea of what the Hillary Clinton short list is, and then the people that they have to publicly say they're vetting.
0690	CHUCK TODD	Let me put up the first five that were mentioned, because this feels like an actual Clinton official saying, "This is who the first five preferences are."
0691	CHUCK TODD	The two Virginia senators and former governors, Tim Kaine and Mark Warner, obvious Virginia swing state.
0692	CHUCK TODD	Sherrod Brown, progressive activist, and from a swing state in Ohio.
0693	CHUCK TODD	Former Governor Deval Patrick of Massachusetts, somebody that many Obama people wish ran for president.
0694	CHUCK TODD	And the Labor Secretary Tom Perez, who Joy, I want to start with you, and I want to start with him.
0695	CHUCK TODD	Because he has basically earned his way onto the Clinton campaign's decision to make him on the shortlist.
0696	CHUCK TODD	This came from a Clinton official.
0697	CHUCK TODD	And it was Perez that they put on there initially.
0698	CHUCK TODD	You're not hearing as much about Julin Castro, the HUD secretary that everybody fell in love with as the Latino V.P.
0699	CHUCK TODD	of the future.
0700	JOY-ANN REID	Yeah, and I think with Julin Castro, I think maybe the idea of the age, sort of the juxtaposition of him with Hillary Clinton,
0701	CHUCK TODD	Too much so?
0702	JOY-ANN REID	Tom Perez is somebody is very much respected by Obama world, clearly.
0703	JOY-ANN REID	And so I think that there is this thinking that either the Clinton campaign, in just in sort of talking to the Clinton world, that they either feel like they need to have a Latino to pair with him, to galvanize the Latino electorate, or they need to fix what you could call their "white male" problem.
0704	JOY-ANN REID	And go with somebody that is a progressive white male like a Sherrod Brown or like an Al Franken even, somebody like that that would be outside the box that could help her there.
0705	CHUCK TODD	Let me put up, I should put on that the Clinton campaign then said, "Oh sure, we might look at Elizabeth Warren."
0706	CHUCK TODD	She's on this list.
0707	CHUCK TODD	There were other names that were thrown on there, Julin Castro, Elizabeth Warren, I think publicly have to get vetted for political reasons.
0708	CHUCK TODD	Somebody threw out an Amy Klobuchar, Cory Booker, senator from New Jersey.
0709	CHUCK TODD	And then there was Bill Nelson, which I may have made, and it seemed to be thrown in there, Jose, you're the Floridian here, but it was
0710	JOSE DIAZ-BALART	For Florida.
0711	CHUCK TODD	For Florida, but it was thrown in for another reason.
0712	CHUCK TODD	Apparently, Hillary Clinton loves the idea that both Bush and Obama have had running mates who basically were not going to pursue the presidency while being vice president.
0713	CHUCK TODD	And she kind of liked that.
0714	JOSE DIAZ-BALART	That's interesting.
0715	JOSE DIAZ-BALART	I think Ross Perot said when he was running for president that in his corporate life, he never hired anybody who didn't want his job, because that's the way they all grew.
0716	JOSE DIAZ-BALART	This is the antithesis of that.
0717	JOSE DIAZ-BALART	You don't want to hire someone who wants your job.
0718	JOSE DIAZ-BALART	And maybe that would be someone like Senator Nelson of Florida.
0719	JOSE DIAZ-BALART	But don't rule out Secretary Castro either.
0720	JOSE DIAZ-BALART	He's an extremely charismatic person.
0721	JOSE DIAZ-BALART	And I've got to tell you something, Tim Kaine speaks perfect Spanish, reaches out to the community through, the Hispanic community through Telemundo regularly.
0722	JOSE DIAZ-BALART	These are people who may be hidden, have hidden weapons.
0723	CHUCK TODD	I'm hoping it's Brown, because I can do a Sherrod Brown.
0724	CHUCK TODD	Just for impersonation.
0725	CHUCK TODD	Deval Patrick though, that was intriguing to me.
0726	NICOLLE WALLACE	The identity politics just reek of incredible cynicism to me.
0727	CHUCK TODD	Oh, and you don't think we're going to see identity politics on your side?
0728	NICOLLE WALLACE	Well listen, the debate on the Republican side isn't who will they pick, it's who would do it.
0729	NICOLLE WALLACE	I mean, I'm sorry, we're in a totally different place.
0730	NICOLLE WALLACE	Being honest.
0731	NICOLLE WALLACE	But the identity, this is where Republicans pull their hair, there's such an opportunity on the Republican side, because this is all about identity politics.
0732	NICOLLE WALLACE	It feels very cynical, it feels very Clintonesque.
0733	JOY-ANN REID	Wait a minute, the entire Marco Rubio boomlet was about identity politics and about saying, "If we just throw a Latino at the electorate, it will mesmerize Hispanics."
0734	NICOLLE WALLACE	You saw how it ended, Joy.
0735	NICOLLE WALLACE	Republicans don't fall for it.
0736	JOY-ANN REID	But Republicans ostentatiously did identity politics.
0737	CHUCK TODD	Well no, I think she's right.
0738	CHUCK TODD	The leadership did, the voters rejected it.
0739	CHUCK TODD	Robert, where is running mate going on the Republican side?
0740	ROBERT COSTA	In 1976, Ronald Reagan running against the incumbent president, Gerald Ford, picked Richard Schweiker of Pennsylvania heading into the convention.
0741	ROBERT COSTA	Down at the RNC, a lot of the RNC members and campaign associates were saying Cruz and Kasich are considering picking a running mate heading into Cleveland to try to get a bounce for their campaigns.
0742	CHUCK TODD	All right.
0743	CHUCK TODD	Well, that is going to be fun.
0744	CHUCK TODD	We get four veepstakes instead of two.
0745	CHUCK TODD	Anyway you guys are terrific.
0746	CHUCK TODD	I appreciate it.
0747	CHUCK TODD	Finally though, in memory of Prince, Bruce Springsteen started his show last night by playing a Prince classic, Purple Rain.
0748	CHUCK TODD	So we're going to end our broadcast the same way, with Bruce playing Prince.
0749	CHUCK TODD	And of course, as always if it's Sunday, it's Meet the Press.
