0302	CHUCK TODD	Bernie Sanders is spending the weekend campaigning in Maryland ahead of Tuesday's primary.
0303	CHUCK TODD	It's been a tough week for Sanders.
0304	CHUCK TODD	His chances of beating Hillary Clinton received a near fatal blow after he was convincingly beaten in the New York primary.
0305	CHUCK TODD	Sanders has vowed to fight on.
0306	CHUCK TODD	But he needs to win the remaining contest by some big margins to have any chance of catching Clinton at the Philadelphia convention.
0307	CHUCK TODD	I sat down with him in Baltimore yesterday, and I started by asking him about his differences that still remain with Hillary Clinton.
0308	SYSTEM	(BEGIN TAPE)
0309	CHUCK TODD	Hillary Clinton the other night in her victory speech after New York said this
0310	SYSTEM	(BEGIN TAPE)
0311	SEC. HILLARY CLINTON	And to all the people who supported Senator Sanders, I believe there is much more that unites us than divides us.
0312	SYSTEM	(END TAPE)
0313	CHUCK TODD	Do you agree with her on that?
0314	SEN. BERNIE SANDERS	I think there is a lot that unites us.
0315	SEN. BERNIE SANDERS	I think there's a lot that divides us.
0316	SEN. BERNIE SANDERS	I think the fact that all of us are in agreement that Donald Trump would be a disaster for this country if he became president unites us, the fact that we understand, for example, that climate change is real while our Republican opponents ignore that reality unites us.
0317	SEN. BERNIE SANDERS	But on the other hand, I think what divides us is the understanding on the part of millions of people who are supporting my candidacy that it really is too late for establishment politics and establishment economics.
0318	SEN. BERNIE SANDERS	We have to deal in a very substantive way with income and wealth inequality.
0319	SEN. BERNIE SANDERS	We need to understand why we're the only major country on Earth not to guarantee health care to all people, not to have paid family and medical leave.
0320	SEN. BERNIE SANDERS	And that we have to deal aggressively with a corrupt campaign finance system which allows big money interest to buy elections.
0321	SEN. BERNIE SANDERS	Those are areas I think of difference.
0322	CHUCK TODD	Well, it's interesting you say they're differences.
0323	CHUCK TODD	If she were here she'd say, "I agree with you on campaign finance.
0324	CHUCK TODD	I agree with you on Medicare, I agree with you on"
0325	SEN. BERNIE SANDERS	No, no.
0326	SEN. BERNIE SANDERS	You're no, but that's not
0327	CHUCK TODD	She would say she would agree with those goals.
0328	SEN. BERNIE SANDERS	Well, but we all agree with goals.
0329	SEN. BERNIE SANDERS	I mean, I suppose everybody has general understanding, you know, that we don't want to see a nuclear war and so forth.
0330	SEN. BERNIE SANDERS	But I think that I believe in a Medicare for all, singlepayer program that guarantees health care to all people.
0331	SEN. BERNIE SANDERS	I have not only shown by talk, but by walking the walk that you can run a campaign  a strong, winning, national campaign  getting millions of individuals to make small campaign contributions.
0332	SEN. BERNIE SANDERS	That has not been Secretary Clinton's approach.
0333	SEN. BERNIE SANDERS	We have not been dependent on big money interest.
0334	SEN. BERNIE SANDERS	And that is perhaps the most important thing.
0335	SEN. BERNIE SANDERS	Because I'm not quite sure that you're ever going to change this country, you're ever going to take on the billionaire class, ever going to create a government that works for the middle class, so long as you're dependent on Wall Street money and big money interest.
0336	CHUCK TODD	You wake up the day after the convention and you're not the nominee.
0337	CHUCK TODD	Do you look in the mirror and say, "This was a successful campaign?"
0338	SEN. BERNIE SANDERS	Well, obviously our goal now is while we have a narrow path to victory, we're going to fight for and through that path.
0339	SEN. BERNIE SANDERS	We hope to win.
0340	SEN. BERNIE SANDERS	But I think the fact that we have shown that there is massive dissatisfaction in this country with the status quo, that people want to think bigger, that people understand that when you have 20 people in this country owning more wealth than the bottom 150 million people, that people are showing in this campaign the desire to stand up and fight back.
0341	SEN. BERNIE SANDERS	The fact that we have brought millions of young people who I think many of the pundits had thought were kind of apathetic, not interested in politics.
0342	SEN. BERNIE SANDERS	Well, you know what?
0343	SEN. BERNIE SANDERS	These young people know they're the future of this country.
0344	SEN. BERNIE SANDERS	They want to shape the future.
0345	SEN. BERNIE SANDERS	And I'm very proud that we have been able to bring them into the political process.
0346	CHUCK TODD	You just described it as a narrow path.
0347	SEN. BERNIE SANDERS	Yes.
0348	CHUCK TODD	So what is it?
0349	CHUCK TODD	Explain it to me?
0350	SEN. BERNIE SANDERS	Well, we're going to have to do obviously win big in the number of the primaries and caucuses that yet remain.
0351	SEN. BERNIE SANDERS	A poll came out yesterday that has us within striking distance in California, a larger state.
0352	SEN. BERNIE SANDERS	I think we can do very well in California.
0353	CHUCK TODD	But it starts with winning some states here, winning a Pennsylvania, winning Connecticut
0354	SEN. BERNIE SANDERS	It means well, bottom line, the arithmetic is you got to win delegates, that's what it means.
0355	SEN. BERNIE SANDERS	We have won twelve
0356	CHUCK TODD	And in this case, it means big primary wins?
0357	SEN. BERNIE SANDERS	Right.
0358	SEN. BERNIE SANDERS	We have won 1,200 delegates.
0359	SEN. BERNIE SANDERS	And by the way, when we talk about the campaign, you know, we started this campaign 60, 65 points behind Secretary Clinton in national polls.
0360	SEN. BERNIE SANDERS	Now many of these polls have us even, a few points ahead perhaps.
0361	SEN. BERNIE SANDERS	Many of the polls now show us and this is an important point, Chuck  when Democrats look out into the horizon, what unites us is the understanding that Trump would be a disastrous president.
0362	SEN. BERNIE SANDERS	Look at the polls.
0363	SEN. BERNIE SANDERS	Bernie Sanders runs better against Trump in almost all of these polls than does Hillary Clinton.
0364	CHUCK TODD	But she runs well, too?
0365	SEN. BERNIE SANDERS	She runs well, too.
0366	SEN. BERNIE SANDERS	But, well, in some 
0367	CHUCK TODD	I mean, so does that hurt your cause a little bit?
0368	CHUCK TODD	It's like, yeah, you do better.
0369	CHUCK TODD	But she runs pretty well, too.
0370	SEN. BERNIE SANDERS	Well, I think the answer is depending on the polls.
0371	SEN. BERNIE SANDERS	And polls are polls.
0372	SEN. BERNIE SANDERS	I don't want to go crazy on polls.
0373	SEN. BERNIE SANDERS	But I think many Democrats are convinced that what is most important is defeating Donald Trump.
0374	SEN. BERNIE SANDERS	And I believe the objective evidence is that I'm the stronger candidate.
0375	CHUCK TODD	So, I was just going to say, at the end of the day, you feel like you were given a fair shot at this nomination?
0376	SEN. BERNIE SANDERS	Yeah, we took advantage of the opportunities in front of us.
0377	SEN. BERNIE SANDERS	We are in this race.
0378	SEN. BERNIE SANDERS	We are not writing our obituary.
0379	SEN. BERNIE SANDERS	We're in this race to California, and we're proud of the campaign we ran.
0380	CHUCK TODD	We crunched some interesting numbers here.
0381	CHUCK TODD	So 17 of the 25 states with the highest levels of income inequality have held primaries.
0382	CHUCK TODD	Sixteen of those 17 states have been won by Hillary Clinton, not by you.
0383	CHUCK TODD	Why?
0384	SEN. BERNIE SANDERS	Well, because poor people don't vote.
0385	SEN. BERNIE SANDERS	I mean, that's just a fact.
0386	SEN. BERNIE SANDERS	That's a sad reality of American society.
0387	SEN. BERNIE SANDERS	And that's what we have to transform.
0388	SEN. BERNIE SANDERS	We have one as you know, one of the lowest voter turnouts of any major country on Earth.
0389	SEN. BERNIE SANDERS	We have done a good job bringing young people in.
0390	SEN. BERNIE SANDERS	I think we have done had some success with lower income people.
0391	SEN. BERNIE SANDERS	But in America today  the last election in 2014, 80 percent of poor people did not vote.
0392	CHUCK TODD	You feel as if you could find a way to get people that are fighting at that poverty line you know, either just below it or just above it, if they were getting engaged in the process, you would do better?
0393	SEN. BERNIE SANDERS	If we can significantly increase voter turnout so that low income people and working people and young people participated in the political process, if we got a voter turnout of 75 percent, this country would be radically transformed.
0394	CHUCK TODD	President Obama's getting a little bit of criticism in the U.K. for speaking out against he doesn't want to see British citizens vote to take the U.K. out of the E.U.
0395	CHUCK TODD	First of all, where are you on that?
0396	CHUCK TODD	And second of all, would you insert yourself into this campaign?
0397	SEN. BERNIE SANDERS	Well, let the British people make their own decisions on that.
0398	CHUCK TODD	So you don't think the president should be commenting on this?
0399	SEN. BERNIE SANDERS	The President has every right to comment on what he wants.
0400	SEN. BERNIE SANDERS	Though I'm a candidate for president right now, I'm not going to.
0401	CHUCK TODD	So as president you would not have a?
0402	SEN. BERNIE SANDERS	I didn't say that, no.
0403	SEN. BERNIE SANDERS	He is the president.
0404	SEN. BERNIE SANDERS	I am a candidate for president.
0405	CHUCK TODD	Right, do you have a view on this?
0406	SEN. BERNIE SANDERS	Not a significant one, no.
0407	SEN. BERNIE SANDERS	Let the people I think the European Union obviously is a very, very important institution.
0408	SEN. BERNIE SANDERS	But ultimately, the people of Britain are going to make their own decisions.
0409	SEN. BERNIE SANDERS	I would hope that they stay in, but that's their decision.
0410	CHUCK TODD	Why are you against the consumption tax the soda tax in Philadelphia
0411	SEN. BERNIE SANDERS	I'll tell you why.
0412	CHUCK TODD	that would pay for PreK?
0413	CHUCK TODD	Universal PreK. Hillary Clinton's for it.
0414	SEN. BERNIE SANDERS	Yes.
0415	SEN. BERNIE SANDERS	I'll tell you why.
0416	SEN. BERNIE SANDERS	Because it is a totally regressive tax and right now, at a time of massive income and wealth inequality, when the wealthy are getting wealthier many of them pay an effective tax rate lower than working people.
0417	SEN. BERNIE SANDERS	You have large multinational corporations not paying a nickel in federal taxes.
0418	SEN. BERNIE SANDERS	That's where you get the money.
0419	SEN. BERNIE SANDERS	Somebody's making $20,000 a year and they buy a bottle of soda, I don't think you charge them $0.30 more for that bottle of soda.
0420	SEN. BERNIE SANDERS	Now, the goal of universal childcare
0421	CHUCK TODD	PreK, yeah
0422	SEN. BERNIE SANDERS	absolutely something that I strongly agree.
0423	SEN. BERNIE SANDERS	And I applaud the mayor there for coming forward.
0424	SEN. BERNIE SANDERS	But raise the money in a way that is progressive, not on the backs of low income or working people.
0425	CHUCK TODD	So you must be against cigarette taxes, too, then?
0426	SEN. BERNIE SANDERS	No, I'm not.
0427	SEN. BERNIE SANDERS	Cigarette taxes are there's a difference between cigarettes and soda.
0428	SEN. BERNIE SANDERS	I am aware of the obesity problem in this country.
0429	CHUCK TODD	I don't think Michael Bloomberg would agree with you on that one?
0430	SEN. BERNIE SANDERS	Well, that's fine.
0431	SEN. BERNIE SANDERS	He can have his point of view.
0432	SEN. BERNIE SANDERS	But cigarettes are causing cancer, obviously, and a dozen other diseases.
0433	SEN. BERNIE SANDERS	And there is almost the question as to why it remains a legal product in this country.
0434	CHUCK TODD	Let me wrap up the question this way.
0435	CHUCK TODD	Do you feel as if Hillary Clinton is the Democratic nominee and you're not, but Donald Trump is the opponent, do you have a responsibility to do what it takes to get your voters to support Hillary Clinton?
0436	SEN. BERNIE SANDERS	I will do everything that I can to make certain that Donald Trump is not elected president.
0437	SEN. BERNIE SANDERS	But if that scenario plays out, the major responsibility will be on Secretary Clinton to convince all people, not just my supporters, that she is the kind of president this country needs to represent working people in this country, to take on the big money interests who have so much power, to fight for what the American people want.
0438	CHUCK TODD	Your supporters are, for the most part, very skeptical of Hillary Clinton.
0439	CHUCK TODD	Very, very skeptical.
0440	CHUCK TODD	Tougher on her, frankly, than you ever are.
0441	CHUCK TODD	You know, people talk about all this back and forth.
0442	CHUCK TODD	What do you think she what's your advice to her on winning your voters over?
0443	SEN. BERNIE SANDERS	Well, I think she's going to have to be very explicit about supporting a program, which stands up for the needs of the middle class and working families, which, most importantly, makes it clear that she is prepared to take on Wall Street in a very clear way, take on the billionaire class, come up with a program that makes health care for all in this country a right within the next several years.
0444	SEN. BERNIE SANDERS	I think those are some of the issues she's going to have to bring forth.
0445	SYSTEM	(END TAPE)
0446	CHUCK TODD	So did we just hear, intentionally or not, the Bernie Sanders exit interview?
0447	CHUCK TODD	We'll get to that later in the show.
0448	CHUCK TODD	Also, why did Donald Trump's magic number to win the nomination, why is it that it might be lower than 1,237?
0449	CHUCK TODD	Ill explain.
0450	CHUCK TODD	And we are back.
0451	CHUCK TODD	Data download time.
0452	CHUCK TODD	We've been hearing a lot about the socalled magic number of delegates needed to secure the Republican nomination.
0453	CHUCK TODD	It's 1,237.
0454	CHUCK TODD	It's pretty much tattooed on the foreheads of everybody in the NBC News political unit.
0455	CHUCK TODD	But Trump's magic number could be less.
0456	CHUCK TODD	In fact, it could be a lot less, because he's likely to pick up these socalled unbound delegates.
0457	CHUCK TODD	These are the people that can do whatever they want on the first ballot.
0458	CHUCK TODD	They can vote for whoever, regardless of how their state voted.
0459	CHUCK TODD	So how does it all happen?
0460	CHUCK TODD	Here's our backofthenapkin math.
0461	CHUCK TODD	We're going to start with this magic number of 1,237, and then subtract from that the number of unbound delegates that we're estimating Trump's likely to pick up.
0462	CHUCK TODD	So we're going to start with nine unbound delegates from the collection of Colorado, Wyoming, and Guam contests.
0463	CHUCK TODD	They haven't been awarded to a single candidate yet.
0464	CHUCK TODD	So in our breakdown, we're going to assume that Trump can negotiate his way to three of those folks.
0465	CHUCK TODD	Now, there are the Rubio delegates.
0466	CHUCK TODD	NBC has reported that 34 of the delegates Marco Rubio earned during the primary season will be unbound on that first ballot, negotiating his way to some Rubio supporters, we think Trump can pick up seven of those folks.
0467	CHUCK TODD	Not a lot, but a handful.
0468	CHUCK TODD	Well, now we go to the 54 Pennsylvania delegates who won't be bound to any candidate after Tuesday's primary.
0469	CHUCK TODD	About 60 percent of those running for delegates have indicated publicly that they will either support Trump or whoever wins their congressional district.
0470	CHUCK TODD	Which if you believe our polls is likely to be Trump.
0471	CHUCK TODD	So we're going to put 34 out of those 54 delegates in Trump's column for now.
0472	CHUCK TODD	So all told, that's 44 unbound delegates Trump could pick up, a conservative estimate mind you.
0473	CHUCK TODD	So subtract that from 1,237, and we get a new magic number 1,193.
0474	CHUCK TODD	So that's probably the maximum that he needs here.
0475	CHUCK TODD	That's the real number Trump will need before he starts picking up what we think are those unbound delegates.
0476	CHUCK TODD	Now again, we think this is a conservative estimates.
0477	CHUCK TODD	It's possible Trump can win more of these votes.
0478	CHUCK TODD	Because Trump's expected to sweep all five states on Tuesday.
0479	CHUCK TODD	And then momentum could take over.
0480	CHUCK TODD	He could pick up more of those folks and then his magic number could drop from 1,193 down to 1,150 after the last primary.
0481	CHUCK TODD	And in fact, it may be very hard for the "Stop Trump" movement to keep Trump below 1,150.
0482	CHUCK TODD	Either way, while Trump technically still needs 1,237 in that first ballot, it's clear he does not need that many pledged delegates by the end of voting in June.
0483	CHUCK TODD	And that's what makes the "Stop Trump" forces even more nervous.
0484	CHUCK TODD	Up next, Donald Trump's campaign says he's just been playing the part of a candidate.
0485	CHUCK TODD	That we'll soon see a new Trump.
0486	CHUCK TODD	Well, if that's true, how do you explain this moment yesterday?
0487	SYSTEM	(BEGIN TAPE)
0488	DONALD TRUMP	He can't win with the popular vote, because he's got zero personality, because he lies like a thief, okay?
0489	SYSTEM	(END TAPE)
0490	CHUCK TODD	Welcome back.
0491	CHUCK TODD	The panel is back.
0492	CHUCK TODD	Let's start quickly with some reaction to Bernie Sanders.
0493	CHUCK TODD	Joy?
0494	CHUCK TODD	Poor people don't vote?
0495	JOY-ANN REID	Yeah.
0496	CHUCK TODD	An interesting new excuse from Bernie Sanders.
0497	CHUCK TODD	And then some Hillary supporters have pointed it out, "Oh, first it was the South, now it's poor people."
0498	JOY-ANN REID	Yeah.
0499	JOY-ANN REID	And it really got a huge reaction, just when the preview of the sound came out in just my social media world.
0500	JOY-ANN REID	And I think part of the problem is the word you use, the excuses.
0501	JOY-ANN REID	That you're saying you're running a political revolution, but you keep parsing, "Well, we don't have just the right kind of voter motivated enough or informed enough.
0502	JOY-ANN REID	You know, they're too oldfashioned, or they're too conservative."
0503	JOY-ANN REID	And in this case, sort of putting it off on poverty, I don't think he meant to disparage, clearly, people, and impugn people who are poor.
0504	JOY-ANN REID	But the idea is if you are truly running a revolutionary movement, based on lifting up people at the bottom, then they should be hearing your message or you might not be doing something correctly.
0505	JOSE DIAZ-BALART	You know, look, I think at another time and in another conversation, this would have been an important conversation to have.
0506	JOSE DIAZ-BALART	I think it's a fact of life that in the United States, the amount of people who were citizens in the United States, who aren't registered to vote, and could vote, are huge.
0507	JOSE DIAZ-BALART	And this country would look differently if from our elected official if everybody voted.
0508	JOSE DIAZ-BALART	I mean look, at Telemundo, we have a campaign, yo resido , it's bringing in people to register to vote.
0509	JOSE DIAZ-BALART	It would be a different country if everyone was registered to vote.
0510	JOSE DIAZ-BALART	It's just that conversation at the time you had it.
0511	NICOLLE WALLACE	But the only people who give excuses for why they're losing are the people who should probably be out.
0512	NICOLLE WALLACE	And I can't understand why there isn't more pressure on him to get out.
0513	NICOLLE WALLACE	When she was
0514	CHUCK TODD	You're surprised?
0515	NICOLLE WALLACE	When she was in his position in 2008, there was a crushing cacophony of voices from the media, and the dem
0516	JOY-ANN REID	She didnt, though.
0517	NICOLLE WALLACE	Well, she did.
0518	NICOLLE WALLACE	And she was still winning.
0519	JOY-ANN REID	She didnt.
0520	JOY-ANN REID	She went to the end.
0521	NICOLLE WALLACE	I can't imagine what reason there is, other than chaos
0522	JOSE DIAZ-BALART	Forty million plus a month?
0523	NICOLLE WALLACE	Other than the chaos on the Republican side for him staying in and doing her damage.
0524	NICOLLE WALLACE	He's not making
0525	JOSE DIAZ-BALART	Nicolle, he's getting millions and millions of dollars in small contributions.
0526	JOSE DIAZ-BALART	NICOLLE WALLACE
0527	JOSE DIAZ-BALART	To what end?
0528	JOSE DIAZ-BALART	He can't be the nominee, and he can't win.
0529	JOSE DIAZ-BALART	People believe in him.
0530	NICOLLE WALLACE	But to call her unqualified, to question her ethics is something that if the Republicans were in a stronger position, this is where the despair on the Republican side comes
0531	JOY-ANN REID	But you know what, the reason for him to continue though is that you still have, you have a small number of states left.
0532	JOY-ANN REID	But we've come this far in the process.
0533	JOY-ANN REID	And I think the voters
0534	NICOLLE WALLACE	There's nowhere to go, Joy!
0535	JOSE DIAZ-BALART	What about California?
0536	JOSE DIAZ-BALART	California.
0537	JOY-ANN REID	Democratic voters have made it very clear that they all want to weigh in.
0538	JOY-ANN REID	I think, you know what?
0539	JOY-ANN REID	Let's give people a chance
0540	NICOLLE WALLACE	Thats fine.
0541	JOSE DIAZ-BALART	It's called democracy.
0542	JOY-ANN REID	It's called democracy.
0543	NICOLLE WALLACE	He's not going to be the nominee.
0544	CHUCK TODD	Go ahead, Bob.
0545	ROBERT COSTA	If you listen to the end of the interview, he's quite positive about the future of the party.
0546	CHUCK TODD	He's oddly conciliatory at the end.
0547	CHUCK TODD	Yes.
0548	ROBERT COSTA	He's conciliatory.
0549	ROBERT COSTA	And he said
0550	NICOLLE WALLACE	Because he knows hes going to lose.
0551	ROBERT COSTA	But he's also willing to offer the branch to Secretary Clinton and say, "If she wins the nomination, Trump is the main target for Democrats, and the party will come together."
0552	ROBERT COSTA	And I was just struck by that moment at the end, in spite of all the animus we've seen, that's his closing statement.
0553	CHUCK TODD	By the way, I want to go, let's turn back to the Republicans here.
0554	CHUCK TODD	I want to play, it was interesting to see, is Trump pivoting to a general election, and it had to do with comments he made about Caitlyn Jenner and bathrooms.
0555	CHUCK TODD	First of all, let me play that excerpt from The Today Show town hall earlier in the week.
0556	SYSTEM	(BEGIN TAPE)
0557	DONALD TRUMP	You leave it the way it is.
0558	DONALD TRUMP	There have been very few complaints the way it is.
0559	DONALD TRUMP	People go, they use the bathroom that they feel is appropriate.
0560	DONALD TRUMP	There has been so little trouble.
0561	MATT LAUER	So if Caitlyn Jenner were to walk into Trump Tower and want to use the bathroom, you would be fine with her using any bathroom she chooses?
0562	DONALD TRUMP	That is correct.
0563	SYSTEM	(END TAPE)
0564	CHUCK TODD	Well, the Cruz campaign has unloaded on those comments.
0565	CHUCK TODD	Nicolle, let me show it to you.
0566	SYSTEM	(BEGIN TAPE)
0567	ANNOUNCER	Guess who's joined the ranks of the P.C.
0568	ANNOUNCER	police?
0569	DONALD TRUMP	People go, they use the bathroom that they feel is appropriate.
0570	ANNOUNCER	Donald Trump can't be trusted with common sense.
0571	ANNOUNCER	Why would we trust him in the White House?
0572	SYSTEM	(END TAPE)
0573	CHUCK TODD	Nicolle, we haven't seen an attack ad from Cruz on Trump in a long time.
0574	CHUCK TODD	It feels like it's been a while.
0575	CHUCK TODD	And that's what he chose to do.
0576	CHUCK TODD	Effective or no?
0577	NICOLLE WALLACE	Well, here's where Trump is an insult wrapped in a riddle wrapped in an opportunity.
0578	NICOLLE WALLACE	I mean, Trump's answer made so much sense, and I think what is also on the line in this cycle is the power and the saliency of social issues.
0579	NICOLLE WALLACE	And I think if Trump wins, it delivers a massive blow to the idea that you have to be up and down on social issues to be the Republican nominee.
0580	CHUCK TODD	I was just surprised by Cruz's decision to do that.
0581	CHUCK TODD	Robert?
0582	ROBERT COSTA	To be able to win these coming states, Cruz needs to rouse the social conservatives.
0583	ROBERT COSTA	I think Trump's answer tells us a lot about how he would be in a general election.
0584	ROBERT COSTA	This is someone who has not climbed the ladder, forming relationships with social conservatives along the way.
0585	ROBERT COSTA	He's someone forged in New York's tabloid business culture, he has relationships with all kinds of people, he's not just someone who surrounds himself with Republicans and conservatives.
0586	ROBERT COSTA	And that actually strangely worries Democrats, that he wouldn't be appealing to moderates.
0587	CHUCK TODD	JoyAnn, I'm going to have you chime in, but I want to play what Hillary Clinton, Hillary Clinton has a web video out, also using The Today Show moment to make a different point from Ted Cruz.
0588	CHUCK TODD	Watch.
0589	SYSTEM	(BEGIN TAPE)
0590	DONALD TRUMP	I will be changing very rapidly.
0591	DONALD TRUMP	I'm very capable of changing to anything I want to change to.
0592	SYSTEM	(END TAPE)
0593	CHUCK TODD	And then they go on to play it, and it's a very long thing, they want to call it an EtchASketch, in a reference to Mitt Romney
0594	JOY-ANN REID	I think it
0595	CHUCK TODD	and Santorum back in the day.
0596	JOY-ANN REID	Well, because Donald Trump is clearly, he has exposed the fact that a lot of the base of the Republican party are not movement conservatives who have spent their entire lives pouring over the doctrinaire minutia of conservative beliefs.
0597	JOY-ANN REID	And what he said was common sense.
0598	JOY-ANN REID	I think that is the big risk of Trump.
