0273	SYSTEM	[Applause]
0274	Donald Trump	But to break the cycle of poverty, we must also break the cycle of violence.
0275	Donald Trump	The murder rate in 2015 experienced its largest singleyear increase in nearly half a century.
0276	SYSTEM	[Fact check True, but somewhat misleading.]
0277	Donald Trump	In Chicago, more than 4,000 people were shot last year alone, and the murder rate so far this year has been even higher.
0278	Donald Trump	This is not acceptable in our society.
0279	SYSTEM	[Applause]
0280	Donald Trump	Every American child should be able to grow up in a safe community, to attend a great school and to have access to a highpaying job.
0281	SYSTEM	[Applause]
0282	Donald Trump	But to create this future, we must work with  not against  not against  the men and women of law enforcement.
0283	SYSTEM	[Applause]
0284	Donald Trump	We must build bridges of cooperation and trust, not drive the wedge of disunity and it's  really, it's what it is, division.
0285	Donald Trump	It's pure, unadulterated division.
0286	Donald Trump	We have to unify.
0287	Donald Trump	Police and sheriffs are members of our community.
0288	Donald Trump	They're friends and neighbors, they're mothers and fathers, sons and daughters, and they leave behind loved ones every day who worry about whether or not they'll come home safe and sound.
0289	Donald Trump	We must support the incredible men and women of law enforcement.
0290	SYSTEM	[Applause]
0291	Donald Trump	And we must support the victims of crime.
0292	Donald Trump	I have ordered the Department of Homeland Security to create an office to serve American victims.
0293	Donald Trump	The office is called Voice, Victims of Immigration Crime Engagement. We are providing a voice to those who have been ignored by our media
0294	SYSTEM	[Fact check They have received coverage.]
0295	Donald Trump	and silenced by special interests. Joining us...
0296	SYSTEM	[Applause]
0297	Donald Trump	Joining us in the audience tonight are four very brave Americans whose government failed them.
0298	Donald Trump	Their names are Jamiel Shaw, Susan Oliver, Jenna Oliver and Jessica Davis.
0299	Donald Trump	Jamiel's 17yearold son was viciously murdered by an illegal immigrant gang member who had just been released from prison.
0300	Donald Trump	Jamiel Shaw Jr. was an incredible young man with unlimited potential who was getting ready to go to college, where he would have excelled as a great college quarterback.
0301	Donald Trump	But he never got the chance.
0302	Donald Trump	His father, who is in the audience tonight, has become a very good friend of mine.
0303	Donald Trump	Jamiel, thank you.
0304	Donald Trump	Thank you.
0305	SYSTEM	[Applause]
0306	Donald Trump	Also with us are Susan Oliver and Jessica Davis.
0307	Donald Trump	Their husbands  Deputy Sheriff Danny Oliver and Detective Michael Davis  were slain in the line of duty in California.
0308	Donald Trump	They were pillars of their community.
0309	Donald Trump	These brave men were viciously gunned down by an illegal immigrant with a criminal record and two prior deportations.
0310	Donald Trump	Should have never been in our country.
0311	Donald Trump	Sitting with Susan is her daughter, Jenna.
0312	Donald Trump	Jenna, I want you to know that your father was a hero and that tonight you have the love of an entire country supporting you and praying for you.
0313	SYSTEM	[Applause]
0314	Donald Trump	To Jamiel, Jenna, Susan and Jessica, I want you to know that we will never stop fighting for justice.
0315	Donald Trump	Your loved ones will never, ever be forgotten.
0316	Donald Trump	We will always honor their memory.
0317	SYSTEM	[Applause]
0318	Donald Trump	Finally, to keep America safe, we must provide the men and women of the United States military with the tools they need to prevent war  if they must  they have to fight and they only have to win.
0319	SYSTEM	[Applause]
0320	Donald Trump	I am sending Congress a budget that rebuilds the military, eliminates the defense sequester...
0321	SYSTEM	[Applause]
0322	Donald Trump	... and calls for one of the largest increases in national defense spending in American history.
0323	Donald Trump	My budget will also increase funding for our veterans.
0324	Donald Trump	Our veterans have delivered for this nation, and now we must deliver for them.
0325	SYSTEM	[Applause]
0326	Donald Trump	The challenges we face as a nation are great.
0327	Donald Trump	But our people are even greater.
0328	Donald Trump	And none are greater or braver than those who fight for America in uniform.
0329	SYSTEM	[Applause]
0330	Donald Trump	We are blessed to be joined tonight by Carryn Owens, the widow of U.S. Navy special operator, Senior Chief William "Ryan" Owens.
0331	Donald Trump	Ryan died as he lived, a warrior and a hero, battling against terrorism and securing our nation.
0332	SYSTEM	[Applause]
0333	Donald Trump	I just spoke to our great General
0334	SYSTEM	[Jim]
0335	Donald Trump	Mattis just now who reconfirmed that, and I quote, "Ryan was a part of a highly successful raid that generated large amounts of vital intelligence that will lead to many more victories in the future against our enemy."
0336	Donald Trump	Ryan's legacy is etched into eternity.
0337	Donald Trump	Thank you.
0338	SYSTEM	[Applause]
0339	Donald Trump	And Ryan is looking down right now.
0340	Donald Trump	You know that.
0341	Donald Trump	And he's very happy, because I think he just broke a record.
0342	SYSTEM	[Applause]
0343	Donald Trump	For as the Bible teaches us, there is no greater act of love than to lay down one's life for one's friends.
0344	Donald Trump	Ryan laid down his life for his friends, for his country and for our freedom.
0345	Donald Trump	And we will never forget Ryan.
0346	SYSTEM	[Applause]
0347	Donald Trump	To those allies who wonder what kind of a friend America will be, look no further than the heroes who wear our uniform.
0348	Donald Trump	Our foreign policy calls for a direct, robust and meaningful engagement with the world.
0349	Donald Trump	It is American leadership based on vital security interests that we share with our allies all across the globe. We strongly support NATO, an alliance forged through the bonds of two world wars, that dethroned fascism...
0350	SYSTEM	[Applause]
0351	Donald Trump	... and a Cold War and defeated communism.
0352	SYSTEM	[Applause]
0353	Donald Trump	But our partners must meet their financial obligations.
0354	Donald Trump	And now, based on our very strong and frank discussions, they are beginning to do just that.
0355	Donald Trump	In fact, I can tell you the money is pouring in.
0356	Donald Trump	Very nice.
0357	SYSTEM	[Applause]
0358	Donald Trump	We expect our partners, whether in NATO, in the Middle East or in the Pacific, to take a direct and meaningful role in both strategic and military operations, and pay their fair share of the cost  have to do that.
0359	Donald Trump	We will respect historic institutions, but we will respect the foreign rights of all nations.
0360	Donald Trump	And they have to respect our rights as a nation, also.
0361	SYSTEM	[Applause]
0362	Donald Trump	Free nations are the best vehicle for expressing the will of the people, and America respects the right of all nations to chart their own path.
0363	Donald Trump	My job is not to represent the world.
0364	Donald Trump	My job is to represent the United States of America.
0365	SYSTEM	[Applause]
0366	Donald Trump	But we know that America is better off when there is less conflict, not more.
0367	Donald Trump	We must learn from the mistakes of the past.
0368	Donald Trump	We have seen the war and the destruction that have ravaged and raged throughout the world.
0369	Donald Trump	All across the world.
0370	Donald Trump	The only longterm solution for these humanitarian disasters, in many cases, is to create the conditions where displaced persons can safely return home and begin the long, long process of rebuilding.
0371	SYSTEM	[Applause]
0372	Donald Trump	America is willing to find new friends, and to forge new partnerships, where shared interests align.
0373	Donald Trump	We want harmony and stability, not war and conflict.
0374	Donald Trump	We want peace, wherever peace can be found.
0375	Donald Trump	America is friends today with former enemies.
0376	Donald Trump	Some of our closest allies, decades ago, fought on the opposite side of these terrible, terrible wars.
0377	Donald Trump	This history should give us all faith in the possibilities for a better world.
0378	Donald Trump	Hopefully, the 250th year for America will see a world that is more peaceful, more just, and more free.
0379	Donald Trump	On our 100th anniversary in 1876, citizens from across our nation came to Philadelphia to celebrate America's centennial.
0380	Donald Trump	At that celebration, the country's builders and artists and inventors showed off their wonderful creations.
0381	Donald Trump	Alexander Graham Bell displayed his telephone for the first time.
0382	Donald Trump	Remington unveiled the first typewriter.
0383	Donald Trump	An early attempt was made at electric light.
0384	Donald Trump	Thomas Edison showed an automatic telegraph and an electric pen.
0385	Donald Trump	Imagine the wonders our country could know in America's 250th year.
0386	SYSTEM	[Applause]
0387	Donald Trump	Think of the marvels we could achieve if we simply set free the dreams of our people.
0388	Donald Trump	Cures to the illnesses that have always plagued us are not too much to hope.
0389	Donald Trump	American footprints on distant worlds are not too big a dream.
0390	Donald Trump	Millions lifted from welfare to work is not too much to expect.
0391	Donald Trump	And streets where mothers are safe from fear  schools where children learn in peace, and jobs where Americans prosper and grow  are not too much to ask.
0392	SYSTEM	[Applause]
0393	Donald Trump	When we have all of this, we will have made America greater than ever before, for all Americans.
0394	Donald Trump	This is our vision.
0395	Donald Trump	This is our mission.
0396	Donald Trump	But we can only get there together.
0397	Donald Trump	We are one people, with one destiny.
0398	Donald Trump	We all bleed the same blood.
0399	Donald Trump	We all salute the same great American flag.
0400	Donald Trump	And we are all made by the same God.
0401	SYSTEM	[Applause]
0402	Donald Trump	When we fulfill this vision, when we celebrate our 250 years of glorious freedom, we will look back on tonight as when this new chapter of American greatness began.
0403	Donald Trump	The time for small thinking is over.
0404	Donald Trump	The time for trivial fights is behind us.
0405	Donald Trump	We just need the courage to share the dreams that fill our hearts, the bravery to express the hopes that stir our souls, and the confidence to turn those hopes and those dreams into action.
0406	Donald Trump	From now on, America will be empowered by our aspirations, not burdened by our fears, inspired by the future, not bound by failures of the past, and guided by a vision, not blinded by our doubts.
0407	Donald Trump	I am asking all citizens to embrace this renewal of the American spirit.
0408	Donald Trump	I am asking all members of Congress to join me in dreaming big and bold and daring things for our country.
0409	Donald Trump	I am asking everyone watching tonight to seize this moment.
0410	Donald Trump	Believe in yourselves.
0411	Donald Trump	Believe in your future.
0412	Donald Trump	And believe, once more, in America.
0413	Donald Trump	Thank you, God bless you, and God bless the United States.
